aiter/configs/model_configs/gptoss_bf16_tuned_gemm.csv
gfx,cu_num,M,N,K,bias,dtype,outdtype,scaleAB,bpreshuffle,libtype,solidx,splitK,us,kernelName,err_ratio,tflops,bw
gfx950,256,1,128,2880,True,torch.bfloat16,torch.bfloat16,False,False,flydsl,686,15,4.2178,flydsl_gemm2_abf16_wbf16_bf16_t16x32x192_split_k15_block_m_warp1_block_n_warp2_async_copyTrue_b_to_ldsFalse_b_preshuffleFalse_c_to_ldsFalse_small_m_wpe4_gfx950,0.0156,0.17,176.23
gfx950,256,2,128,2880,True,torch.bfloat16,torch.bfloat16,False,False,flydsl,686,15,4.3068,flydsl_gemm2_abf16_wbf16_bf16_t16x32x192_split_k15_block_m_warp1_block_n_warp2_async_copyTrue_b_to_ldsFalse_b_preshuffleFalse_c_to_ldsFalse_small_m_wpe4_gfx950,0.0234,0.34,173.98
gfx950,256,4,128,2880,True,torch.bfloat16,torch.bfloat16,False,False,flydsl,675,15,4.2346,flydsl_gemm2_abf16_wbf16_bf16_t16x32x192_split_k15_block_m_warp1_block_n_warp1_async_copyTrue_b_to_ldsFalse_b_preshuffleFalse_c_to_ldsFalse_small_m_gfx950,0.0332,0.7,179.79
gfx950,256,8,128,2880,True,torch.bfloat16,torch.bfloat16,False,False,flydsl,684,15,4.4391,flydsl_gemm2_abf16_wbf16_bf16_t16x32x192_split_k15_block_m_warp1_block_n_warp2_async_copyTrue_b_to_ldsFalse_b_preshuffleFalse_c_to_ldsFalse_small_m_gfx950,0.0264,1.33,176.93
gfx950,256,16,128,2880,True,torch.bfloat16,torch.bfloat16,False,False,flydsl,936,15,4.4164,flydsl_gemm2_abf16_wbf16_bf16_t16x32x64_split_k15_block_m_warp1_block_n_warp2_async_copyTrue_b_to_ldsFalse_b_preshuffleFalse_c_to_ldsFalse_small_m_gfx950,0.0244,2.67,188.74
gfx950,256,32,128,2880,True,torch.bfloat16,torch.bfloat16,False,False,flydsl,75,15,4.6431,flydsl_gemm2_abf16_wbf16_bf16_t32x64x64_split_k15_block_m_warp2_block_n_warp2_async_copyTrue_b_to_ldsTrue_b_preshuffleFalse_c_to_ldsFalse_gfx950,0.0249,5.08,200.25
gfx950,256,48,128,2880,True,torch.bfloat16,torch.bfloat16,False,False,flydsl,75,15,4.6231,flydsl_gemm2_abf16_wbf16_bf16_t32x64x64_split_k15_block_m_warp2_block_n_warp2_async_copyTrue_b_to_ldsTrue_b_preshuffleFalse_c_to_ldsFalse_gfx950,0.0251,7.65,221.94
gfx950,256,64,128,2880,True,torch.bfloat16,torch.bfloat16,False,False,flydsl,311,15,4.6492,flydsl_gemm2_abf16_wbf16_bf16_t32x64x64_split_k15_block_m_warp2_block_n_warp2_async_copyTrue_b_to_ldsTrue_b_preshuffleFalse_c_to_ldsFalse_gfx950,0.0223,10.15,241.4
gfx950,256,80,128,2880,True,torch.bfloat16,torch.bfloat16,False,False,flydsl,398,15,4.9066,flydsl_gemm2_abf16_wbf16_bf16_t32x64x64_split_k15_block_m_warp1_block_n_warp4_async_copyTrue_b_to_ldsFalse_b_preshuffleFalse_c_to_ldsFalse_gfx950,0.0239,12.02,248.35
gfx950,256,96,128,2880,True,torch.bfloat16,torch.bfloat16,False,False,flydsl,600,15,5.0682,flydsl_gemm2_abf16_wbf16_bf16_t64x64x64_split_k15_block_m_warp1_block_n_warp4_async_copyTrue_b_to_ldsTrue_b_preshuffleFalse_c_to_ldsFalse_gfx950,0.0245,13.97,259.42
gfx950,256,112,128,2880,True,torch.bfloat16,torch.bfloat16,False,False,flydsl,398,15,5.1854,flydsl_gemm2_abf16_wbf16_bf16_t32x64x64_split_k15_block_m_warp1_block_n_warp4_async_copyTrue_b_to_ldsFalse_b_preshuffleFalse_c_to_ldsFalse_gfx950,0.0241,15.92,272.12
gfx950,256,128,128,2880,True,torch.bfloat16,torch.bfloat16,False,False,asm,5,9,5.5995,_ZN5aiter39bf16gemm_fp32bf16_tn_64x64_splitk_cleanE,0.0169,16.85,269.19
gfx950,256,256,128,2880,True,torch.bfloat16,torch.bfloat16,False,False,flydsl,623,9,6.6067,flydsl_gemm2_abf16_wbf16_bf16_t32x64x64_split_k9_block_m_warp2_block_n_warp2_async_copyTrue_b_to_ldsTrue_b_preshuffleFalse_c_to_ldsFalse_gfx950,0.018,28.57,344.71
gfx950,256,1,2560,2880,True,torch.bfloat16,torch.bfloat16,False,False,flydsl,2028,15,6.8559,flydsl_gemm2_abf16_wbf16_bf16_t16x32x192_split_k15_block_m_warp1_block_n_warp1_async_copyTrue_b_to_ldsFalse_b_preshuffleFalse_c_to_ldsFalse_small_m_wpe4_gfx950,0.023,2.15,2152.38
gfx950,256,2,2560,2880,True,torch.bfloat16,torch.bfloat16,False,False,flydsl,598,10,7.0605,flydsl_gemm2_abf16_wbf16_bf16_t16x128x96_split_k10_block_m_warp1_block_n_warp4_async_copyTrue_b_to_ldsFalse_b_preshuffleFalse_c_to_ldsFalse_small_m_wpe2_gfx950,0.0199,4.18,2091.55
gfx950,256,4,2560,2880,True,torch.bfloat16,torch.bfloat16,False,False,flydsl,3178,9,6.8919,flydsl_gemm2_abf16_wbf16_bf16_t16x64x160_split_k9_block_m_warp1_block_n_warp4_async_copyTrue_b_to_ldsFalse_b_preshuffleFalse_c_to_ldsFalse_small_m_gfx950,0.0215,8.56,2145.87
gfx950,256,8,2560,2880,True,torch.bfloat16,torch.bfloat16,False,False,flydsl,3311,5,7.3191,flydsl_gemm2_abf16_wbf16_bf16_t16x64x192_split_k5_block_m_warp1_block_n_warp4_async_copyTrue_b_to_ldsFalse_b_preshuffleFalse_c_to_ldsFalse_small_m_wpe2_gfx950,0.0128,16.12,2026.57
gfx950,256,16,2560,2880,True,torch.bfloat16,torch.bfloat16,False,False,flydsl,3801,9,8.4762,flydsl_gemm2_abf16_wbf16_bf16_t16x64x64_split_k9_block_m_warp1_block_n_warp2_async_copyTrue_b_to_ldsFalse_b_preshuffleFalse_c_to_ldsFalse_small_m_gfx950,0.018,27.83,1760.18
gfx950,256,32,2560,2880,True,torch.bfloat16,torch.bfloat16,False,False,asm,1,4,10.0161,_ZN5aiter39bf16gemm_fp32bf16_tn_32x64_splitk_cleanE,0.0099,47.11,1506.95
gfx950,256,48,2560,2880,True,torch.bfloat16,torch.bfloat16,False,False,asm,1,3,10.6198,_ZN5aiter39bf16gemm_fp32bf16_tn_32x64_splitk_cleanE,0.0073,66.65,1437.68
gfx950,256,64,2560,2880,True,torch.bfloat16,torch.bfloat16,False,False,asm,1,3,10.5804,_ZN5aiter39bf16gemm_fp32bf16_tn_32x64_splitk_cleanE,0.0074,89.19,1459.48
gfx950,256,128,2560,2880,True,torch.bfloat16,torch.bfloat16,False,False,asm,5,3,11.8959,_ZN5aiter39bf16gemm_fp32bf16_tn_64x64_splitk_cleanE,0.0074,158.66,1356.62
gfx950,256,256,2560,2880,True,torch.bfloat16,torch.bfloat16,False,False,asm,8,2,15.3473,_ZN5aiter39bf16gemm_fp32bf16_tn_96x64_splitk_cleanE,0.0041,245.96,1142.28
gfx950,256,1,2880,2048,True,torch.bfloat16,torch.bfloat16,False,False,flydsl,330,16,6.0229,flydsl_gemm2_abf16_wbf16_bf16_t16x192x128_split_k16_block_m_warp1_block_n_warp4_async_copyTrue_b_to_ldsTrue_b_preshuffleFalse_c_to_ldsFalse_small_m_wpe2_ur8_gfx950,0.0243,1.96,1960.24
gfx950,256,1,2880,4096,True,torch.bfloat16,torch.bfloat16,False,False,flydsl,3037,16,7.9786,flydsl_gemm2_abf16_wbf16_bf16_t32x64x256_split_k16_block_m_warp1_block_n_warp4_async_copyTrue_b_to_ldsFalse_b_preshuffleFalse_c_to_ldsFalse_gfx950,0.0288,2.96,2958.78
gfx950,256,2,2880,2048,True,torch.bfloat16,torch.bfloat16,False,False,flydsl,330,16,6.1029,flydsl_gemm2_abf16_wbf16_bf16_t16x192x128_split_k16_block_m_warp1_block_n_warp4_async_copyTrue_b_to_ldsTrue_b_preshuffleFalse_c_to_ldsFalse_small_m_wpe2_ur8_gfx950,0.0253,3.87,1936.16
gfx950,256,2,2880,4096,True,torch.bfloat16,torch.bfloat16,False,False,flydsl,1669,16,7.856,flydsl_gemm2_abf16_wbf16_bf16_t16x64x256_split_k16_block_m_warp1_block_n_warp4_async_copyTrue_b_to_ldsFalse_b_preshuffleFalse_c_to_ldsFalse_small_m_wpe4_gfx950,0.0328,6.01,3006.73
gfx950,256,4,2880,2048,True,torch.bfloat16,torch.bfloat16,False,False,flydsl,1105,8,6.5626,flydsl_gemm2_abf16_wbf16_bf16_t16x32x256_split_k8_block_m_warp1_block_n_warp2_async_copyTrue_b_to_ldsTrue_b_preshuffleFalse_c_to_ldsFalse_small_m_wpe4_ur16_gfx950,0.0156,7.19,1803.54
gfx950,256,4,2880,4096,True,torch.bfloat16,torch.bfloat16,False,False,flydsl,1668,16,7.9968,flydsl_gemm2_abf16_wbf16_bf16_t16x64x256_split_k16_block_m_warp1_block_n_warp4_async_copyTrue_b_to_ldsFalse_b_preshuffleFalse_c_to_ldsFalse_small_m_wpe2_gfx950,0.0294,11.8,2957.28
gfx950,256,8,2880,2048,True,torch.bfloat16,torch.bfloat16,False,False,flydsl,2739,8,5.4083,flydsl_gemm2_abf16_wbf16_bf16_t32x192x64_split_k8_block_m_warp1_block_n_warp4_async_copyTrue_b_to_ldsTrue_b_preshuffleFalse_c_to_ldsFalse_gfx950,0.0156,17.45,2195.76
gfx950,256,8,2880,4096,True,torch.bfloat16,torch.bfloat16,False,False,flydsl,2378,8,8.1624,flydsl_gemm2_abf16_wbf16_bf16_t16x96x128_split_k8_block_m_warp1_block_n_warp3_async_copyTrue_b_to_ldsFalse_b_preshuffleFalse_c_to_ldsFalse_small_m_wpe2_gfx950,0.018,23.12,2904.12
gfx950,256,16,2880,2048,True,torch.bfloat16,torch.bfloat16,False,False,flydsl,1595,4,6.8816,flydsl_gemm2_abf16_wbf16_bf16_t16x64x256_split_k4_block_m_warp1_block_n_warp4_async_copyTrue_b_to_ldsFalse_b_preshuffleFalse_c_to_ldsFalse_small_m_wpe2_gfx950,0.0104,27.43,1737.12
gfx950,256,16,2880,4096,True,torch.bfloat16,torch.bfloat16,False,False,flydsl,1808,8,9.0275,flydsl_gemm2_abf16_wbf16_bf16_t16x64x256_split_k8_block_m_warp1_block_n_warp4_async_copyTrue_b_to_ldsFalse_b_preshuffleFalse_c_to_ldsFalse_small_m_wpe2_gfx950,0.0204,41.82,2638.18
gfx950,256,32,2880,2048,True,torch.bfloat16,torch.bfloat16,False,False,flydsl,584,4,7.9485,flydsl_gemm2_abf16_wbf16_bf16_t64x64x256_split_k4_block_m_warp1_block_n_warp4_async_copyTrue_b_to_ldsFalse_b_preshuffleFalse_c_to_ldsFalse_gfx950,0.0104,47.49,1523.79
gfx950,256,32,2880,4096,True,torch.bfloat16,torch.bfloat16,False,False,flydsl,280,4,10.363,flydsl_gemm2_abf16_wbf16_bf16_t32x64x256_split_k4_block_m_warp1_block_n_warp4_async_copyTrue_b_to_ldsFalse_b_preshuffleFalse_c_to_ldsFalse_gfx950,0.0134,72.85,2319.74
gfx950,256,48,2880,2048,True,torch.bfloat16,torch.bfloat16,False,False,flydsl,584,4,9.69,flydsl_gemm2_abf16_wbf16_bf16_t64x64x256_split_k4_block_m_warp1_block_n_warp4_async_copyTrue_b_to_ldsFalse_b_preshuffleFalse_c_to_ldsFalse_gfx950,0.0102,58.43,1266.21
gfx950,256,48,2880,4096,True,torch.bfloat16,torch.bfloat16,False,False,flydsl,665,4,11.7105,flydsl_gemm2_abf16_wbf16_bf16_t64x64x256_split_k4_block_m_warp1_block_n_warp4_async_copyTrue_b_to_ldsFalse_b_preshuffleFalse_c_to_ldsFalse_gfx950,0.0129,96.7,2071.87
gfx950,256,64,2880,2048,True,torch.bfloat16,torch.bfloat16,False,False,torch,0,0,9.7537,native,0.0,77.4,1274.11
gfx950,256,64,2880,4096,True,torch.bfloat16,torch.bfloat16,False,False,asm,5,5,12.4805,_ZN5aiter39bf16gemm_fp32bf16_tn_64x64_splitk_cleanE,0.0136,120.98,1961.93
gfx950,256,80,2880,4096,True,torch.bfloat16,torch.bfloat16,False,False,asm,7,5,12.8884,_ZN5aiter39bf16gemm_fp32bf16_tn_80x64_splitk_cleanE,0.0137,146.44,1917.16
gfx950,256,96,2880,4096,True,torch.bfloat16,torch.bfloat16,False,False,asm,8,5,13.4504,_ZN5aiter39bf16gemm_fp32bf16_tn_96x64_splitk_cleanE,0.0136,168.39,1853.65
gfx950,256,112,2880,4096,True,torch.bfloat16,torch.bfloat16,False,False,torch,0,0,14.7813,native,0.0,178.77,1701.85
gfx950,256,128,2880,2048,True,torch.bfloat16,torch.bfloat16,False,False,torch,0,0,10.2919,native,0.0,146.71,1268.77
gfx950,256,128,2880,4096,True,torch.bfloat16,torch.bfloat16,False,False,torch,0,0,15.1662,native,0.0,199.12,1673.38
gfx950,256,256,2880,2048,True,torch.bfloat16,torch.bfloat16,False,False,torch,0,0,12.3896,native,0.0,243.74,1155.78
gfx950,256,1,5120,2880,True,torch.bfloat16,torch.bfloat16,False,False,flydsl,525,6,9.2602,flydsl_gemm2_abf16_wbf16_bf16_t16x128x160_split_k6_block_m_warp1_block_n_warp4_async_copyTrue_b_to_ldsFalse_b_preshuffleFalse_c_to_ldsFalse_small_m_gfx950,0.0133,3.18,3186.45
gfx950,256,2,5120,2880,True,torch.bfloat16,torch.bfloat16,False,False,flydsl,526,6,9.2735,flydsl_gemm2_abf16_wbf16_bf16_t16x128x160_split_k6_block_m_warp1_block_n_warp4_async_copyTrue_b_to_ldsFalse_b_preshuffleFalse_c_to_ldsFalse_small_m_wpe2_gfx950,0.015,6.36,3183.61
gfx950,256,4,5120,2880,True,torch.bfloat16,torch.bfloat16,False,False,flydsl,527,6,9.0773,flydsl_gemm2_abf16_wbf16_bf16_t16x128x160_split_k6_block_m_warp1_block_n_warp4_async_copyTrue_b_to_ldsFalse_b_preshuffleFalse_c_to_ldsFalse_small_m_wpe4_gfx950,0.0154,13.0,3255.95
gfx950,256,8,5120,2880,True,torch.bfloat16,torch.bfloat16,False,False,flydsl,3759,5,9.8984,flydsl_gemm2_abf16_wbf16_bf16_t16x64x192_split_k5_block_m_warp1_block_n_warp4_async_copyTrue_b_to_ldsFalse_b_preshuffleFalse_c_to_ldsFalse_small_m_wpe4_gfx950,0.0137,23.84,2992.32
gfx950,256,16,5120,2880,True,torch.bfloat16,torch.bfloat16,False,False,flydsl,4215,5,11.326,flydsl_gemm2_abf16_wbf16_bf16_t16x64x64_split_k5_block_m_warp1_block_n_warp2_async_copyTrue_b_to_ldsFalse_b_preshuffleFalse_c_to_ldsFalse_small_m_wpe2_gfx950,0.0143,41.66,2626.45
gfx950,256,32,5120,2880,True,torch.bfloat16,torch.bfloat16,False,False,asm,1,3,12.0387,_ZN5aiter39bf16gemm_fp32bf16_tn_32x64_splitk_cleanE,0.0077,78.39,2492.23
gfx950,256,48,5120,2880,True,torch.bfloat16,torch.bfloat16,False,False,asm,3,3,13.0826,_ZN5aiter39bf16gemm_fp32bf16_tn_48x64_splitk_cleanE,0.0076,108.2,2312.93
gfx950,256,64,5120,2880,True,torch.bfloat16,torch.bfloat16,False,False,asm,5,3,13.6117,_ZN5aiter39bf16gemm_fp32bf16_tn_64x64_splitk_cleanE,0.0077,138.66,2241.84
gfx950,256,80,5120,2880,True,torch.bfloat16,torch.bfloat16,False,False,asm,7,3,13.6666,_ZN5aiter39bf16gemm_fp32bf16_tn_80x64_splitk_cleanE,0.0076,172.63,2251.56
gfx950,256,96,5120,2880,True,torch.bfloat16,torch.bfloat16,False,False,asm,8,3,14.0895,_ZN5aiter39bf16gemm_fp32bf16_tn_96x64_splitk_cleanE,0.0076,200.94,2202.15
gfx950,256,112,5120,2880,True,torch.bfloat16,torch.bfloat16,False,False,torch,0,0,17.0082,native,0.0,194.2,1839.3
gfx950,256,128,5120,2880,True,torch.bfloat16,torch.bfloat16,False,False,torch,0,0,17.1101,native,0.0,220.62,1843.31
