aiter/configs/model_configs/kimik2_asm_bshuffle_bf16_tuned_gemm.csv
cu_num,M,N,K,bias,dtype,outdtype,scaleAB,bpreshuffle,libtype,solidx,splitK,us,kernelName,err_ratio,tflops,bw
256,1,384,7168,False,torch.bfloat16,torch.bfloat16,False,True,asm,2,11,8.8428,_ZN5aiter48bf16gemm_fp32bf16_tn_32x64_bshuffle_splitk_cleanE,0.0156,0.62,624.25
256,2,384,7168,False,torch.bfloat16,torch.bfloat16,False,True,asm,2,11,8.8023,_ZN5aiter48bf16gemm_fp32bf16_tn_32x64_bshuffle_splitk_cleanE,0.0182,1.25,628.84
256,4,384,7168,False,torch.bfloat16,torch.bfloat16,False,True,asm,2,14,8.6961,_ZN5aiter48bf16gemm_fp32bf16_tn_32x64_bshuffle_splitk_cleanE,0.0293,2.53,639.99
256,8,384,7168,False,torch.bfloat16,torch.bfloat16,False,True,asm,2,14,8.7677,_ZN5aiter48bf16gemm_fp32bf16_tn_32x64_bshuffle_splitk_cleanE,0.0306,5.02,641.66
256,16,384,7168,False,torch.bfloat16,torch.bfloat16,False,True,asm,2,14,8.7167,_ZN5aiter48bf16gemm_fp32bf16_tn_32x64_bshuffle_splitk_cleanE,0.0306,10.1,659.27
256,24,384,7168,False,torch.bfloat16,torch.bfloat16,False,True,asm,2,14,8.8549,_ZN5aiter48bf16gemm_fp32bf16_tn_32x64_bshuffle_splitk_cleanE,0.0303,14.92,662.63
256,32,384,7168,False,torch.bfloat16,torch.bfloat16,False,True,asm,2,14,8.7909,_ZN5aiter48bf16gemm_fp32bf16_tn_32x64_bshuffle_splitk_cleanE,0.0288,20.04,681.2
256,40,384,7168,False,torch.bfloat16,torch.bfloat16,False,True,asm,4,14,9.2591,_ZN5aiter48bf16gemm_fp32bf16_tn_48x64_bshuffle_splitk_cleanE,0.0296,23.78,659.8
256,48,384,7168,False,torch.bfloat16,torch.bfloat16,False,True,asm,6,14,9.0747,_ZN5aiter48bf16gemm_fp32bf16_tn_64x64_bshuffle_splitk_cleanE,0.0297,29.12,686.53
256,56,384,7168,False,torch.bfloat16,torch.bfloat16,False,True,asm,6,14,9.5676,_ZN5aiter48bf16gemm_fp32bf16_tn_64x64_bshuffle_splitk_cleanE,0.0276,32.22,663.79
256,64,384,7168,False,torch.bfloat16,torch.bfloat16,False,True,asm,6,14,9.424,_ZN5aiter48bf16gemm_fp32bf16_tn_64x64_bshuffle_splitk_cleanE,0.0284,37.39,686.72
256,72,384,7168,False,torch.bfloat16,torch.bfloat16,False,True,asm,9,14,9.7143,_ZN5aiter48bf16gemm_fp32bf16_tn_96x64_bshuffle_splitk_cleanE,0.0273,40.8,678.64
256,80,384,7168,False,torch.bfloat16,torch.bfloat16,False,True,asm,7,14,9.442,_ZN5aiter48bf16gemm_fp32bf16_tn_80x64_bshuffle_splitk_cleanE,0.0278,46.64,711.01
256,88,384,7168,False,torch.bfloat16,torch.bfloat16,False,True,asm,9,14,9.7058,_ZN5aiter48bf16gemm_fp32bf16_tn_96x64_bshuffle_splitk_cleanE,0.0286,49.91,704.13
256,96,384,7168,False,torch.bfloat16,torch.bfloat16,False,True,asm,9,16,10.4334,_ZN5aiter48bf16gemm_fp32bf16_tn_96x64_bshuffle_splitk_cleanE,0.0312,50.65,666.61
256,104,384,7168,False,torch.bfloat16,torch.bfloat16,False,True,asm,11,14,10.2428,_ZN5aiter49bf16gemm_fp32bf16_tn_128x64_bshuffle_splitk_cleanE,0.0291,55.9,690.81
256,112,384,7168,False,torch.bfloat16,torch.bfloat16,False,True,asm,11,14,10.4224,_ZN5aiter49bf16gemm_fp32bf16_tn_128x64_bshuffle_splitk_cleanE,0.0288,59.16,690.5
256,120,384,7168,False,torch.bfloat16,torch.bfloat16,False,True,asm,11,14,10.9231,_ZN5aiter49bf16gemm_fp32bf16_tn_128x64_bshuffle_splitk_cleanE,0.0286,60.48,669.91
256,128,384,7168,False,torch.bfloat16,torch.bfloat16,False,True,asm,11,14,10.6743,_ZN5aiter49bf16gemm_fp32bf16_tn_128x64_bshuffle_splitk_cleanE,0.0291,66.01,696.85
256,136,384,7168,False,torch.bfloat16,torch.bfloat16,False,True,asm,13,16,10.9836,_ZN5aiter49bf16gemm_fp32bf16_tn_160x64_bshuffle_splitk_cleanE,0.0293,68.16,688.22
256,144,384,7168,False,torch.bfloat16,torch.bfloat16,False,True,asm,13,16,11.195,_ZN5aiter49bf16gemm_fp32bf16_tn_160x64_bshuffle_splitk_cleanE,0.032,70.81,686.02
256,152,384,7168,False,torch.bfloat16,torch.bfloat16,False,True,asm,13,16,11.4371,_ZN5aiter49bf16gemm_fp32bf16_tn_160x64_bshuffle_splitk_cleanE,0.0308,73.16,682.06
256,160,384,7168,False,torch.bfloat16,torch.bfloat16,False,True,asm,13,16,11.4939,_ZN5aiter49bf16gemm_fp32bf16_tn_160x64_bshuffle_splitk_cleanE,0.0309,76.63,689.21
256,168,384,7168,False,torch.bfloat16,torch.bfloat16,False,True,asm,9,8,12.5864,_ZN5aiter48bf16gemm_fp32bf16_tn_96x64_bshuffle_splitk_cleanE,0.0225,73.48,638.98
256,176,384,7168,False,torch.bfloat16,torch.bfloat16,False,True,asm,9,8,12.6379,_ZN5aiter48bf16gemm_fp32bf16_tn_96x64_bshuffle_splitk_cleanE,0.0215,76.66,645.94
256,184,384,7168,False,torch.bfloat16,torch.bfloat16,False,True,asm,9,8,12.7934,_ZN5aiter48bf16gemm_fp32bf16_tn_96x64_bshuffle_splitk_cleanE,0.0213,79.18,647.53
256,192,384,7168,False,torch.bfloat16,torch.bfloat16,False,True,asm,9,9,13.0061,_ZN5aiter48bf16gemm_fp32bf16_tn_96x64_bshuffle_splitk_cleanE,0.0231,81.27,646.23
256,200,384,7168,False,torch.bfloat16,torch.bfloat16,False,True,asm,11,10,13.3094,_ZN5aiter49bf16gemm_fp32bf16_tn_128x64_bshuffle_splitk_cleanE,0.0246,82.72,640.59
256,208,384,7168,False,torch.bfloat16,torch.bfloat16,False,True,asm,11,10,13.4079,_ZN5aiter49bf16gemm_fp32bf16_tn_128x64_bshuffle_splitk_cleanE,0.0248,85.4,644.89
256,216,384,7168,False,torch.bfloat16,torch.bfloat16,False,True,asm,11,10,13.2611,_ZN5aiter49bf16gemm_fp32bf16_tn_128x64_bshuffle_splitk_cleanE,0.0244,89.67,661.14
256,224,384,7168,False,torch.bfloat16,torch.bfloat16,False,True,asm,11,11,13.309,_ZN5aiter49bf16gemm_fp32bf16_tn_128x64_bshuffle_splitk_cleanE,0.0261,92.65,667.84
256,232,384,7168,False,torch.bfloat16,torch.bfloat16,False,True,asm,11,10,13.4395,_ZN5aiter49bf16gemm_fp32bf16_tn_128x64_bshuffle_splitk_cleanE,0.0243,95.03,670.35
256,240,384,7168,False,torch.bfloat16,torch.bfloat16,False,True,asm,11,10,13.428,_ZN5aiter49bf16gemm_fp32bf16_tn_128x64_bshuffle_splitk_cleanE,0.0244,98.39,679.92
256,248,384,7168,False,torch.bfloat16,torch.bfloat16,False,True,asm,4,6,13.7364,_ZN5aiter48bf16gemm_fp32bf16_tn_48x64_bshuffle_splitk_cleanE,0.0185,99.39,673.45
256,256,384,7168,False,torch.bfloat16,torch.bfloat16,False,True,asm,4,6,13.7439,_ZN5aiter48bf16gemm_fp32bf16_tn_48x64_bshuffle_splitk_cleanE,0.0188,102.54,681.88
256,264,384,7168,False,torch.bfloat16,torch.bfloat16,False,True,asm,4,6,13.7383,_ZN5aiter48bf16gemm_fp32bf16_tn_48x64_bshuffle_splitk_cleanE,0.0182,105.79,690.95
256,272,384,7168,False,torch.bfloat16,torch.bfloat16,False,True,asm,4,6,13.8445,_ZN5aiter48bf16gemm_fp32bf16_tn_48x64_bshuffle_splitk_cleanE,0.0184,108.16,694.38
256,280,384,7168,False,torch.bfloat16,torch.bfloat16,False,True,asm,4,6,13.7923,_ZN5aiter48bf16gemm_fp32bf16_tn_48x64_bshuffle_splitk_cleanE,0.0186,111.76,705.77
256,288,384,7168,False,torch.bfloat16,torch.bfloat16,False,True,asm,4,6,13.9685,_ZN5aiter48bf16gemm_fp32bf16_tn_48x64_bshuffle_splitk_cleanE,0.0188,113.5,705.51
256,296,384,7168,False,torch.bfloat16,torch.bfloat16,False,True,asm,6,6,13.6921,_ZN5aiter48bf16gemm_fp32bf16_tn_64x64_bshuffle_splitk_cleanE,0.0189,119.01,728.58
256,304,384,7168,False,torch.bfloat16,torch.bfloat16,False,True,asm,4,5,13.8195,_ZN5aiter48bf16gemm_fp32bf16_tn_48x64_bshuffle_splitk_cleanE,0.0158,121.1,730.61
256,312,384,7168,False,torch.bfloat16,torch.bfloat16,False,True,asm,6,6,13.875,_ZN5aiter48bf16gemm_fp32bf16_tn_64x64_bshuffle_splitk_cleanE,0.0186,123.79,736.39
256,320,384,7168,False,torch.bfloat16,torch.bfloat16,False,True,asm,4,6,13.7855,_ZN5aiter48bf16gemm_fp32bf16_tn_48x64_bshuffle_splitk_cleanE,0.0187,127.79,749.94
256,328,384,7168,False,torch.bfloat16,torch.bfloat16,False,True,asm,4,6,14.1874,_ZN5aiter48bf16gemm_fp32bf16_tn_48x64_bshuffle_splitk_cleanE,0.0191,127.27,737.21
256,336,384,7168,False,torch.bfloat16,torch.bfloat16,False,True,asm,4,5,13.8734,_ZN5aiter48bf16gemm_fp32bf16_tn_48x64_bshuffle_splitk_cleanE,0.0162,133.33,762.61
256,344,384,7168,False,torch.bfloat16,torch.bfloat16,False,True,asm,6,6,14.3032,_ZN5aiter48bf16gemm_fp32bf16_tn_64x64_bshuffle_splitk_cleanE,0.0186,132.4,748.14
256,352,384,7168,False,torch.bfloat16,torch.bfloat16,False,True,asm,6,6,14.2444,_ZN5aiter48bf16gemm_fp32bf16_tn_64x64_bshuffle_splitk_cleanE,0.0188,136.04,759.71
256,360,384,7168,False,torch.bfloat16,torch.bfloat16,False,True,asm,4,5,14.1607,_ZN5aiter48bf16gemm_fp32bf16_tn_48x64_bshuffle_splitk_cleanE,0.0162,139.95,772.73
256,368,384,7168,False,torch.bfloat16,torch.bfloat16,False,True,asm,4,5,14.2135,_ZN5aiter48bf16gemm_fp32bf16_tn_48x64_bshuffle_splitk_cleanE,0.0161,142.53,778.37
256,376,384,7168,False,torch.bfloat16,torch.bfloat16,False,True,asm,4,5,14.3592,_ZN5aiter48bf16gemm_fp32bf16_tn_48x64_bshuffle_splitk_cleanE,0.0163,144.15,778.88
256,384,384,7168,False,torch.bfloat16,torch.bfloat16,False,True,asm,4,5,14.2282,_ZN5aiter48bf16gemm_fp32bf16_tn_48x64_bshuffle_splitk_cleanE,0.0165,148.57,794.55
256,392,384,7168,False,torch.bfloat16,torch.bfloat16,False,True,asm,6,5,14.3109,_ZN5aiter48bf16gemm_fp32bf16_tn_64x64_bshuffle_splitk_cleanE,0.0162,150.79,798.4
256,400,384,7168,False,torch.bfloat16,torch.bfloat16,False,True,asm,6,5,14.4197,_ZN5aiter48bf16gemm_fp32bf16_tn_64x64_bshuffle_splitk_cleanE,0.016,152.71,800.75
256,408,384,7168,False,torch.bfloat16,torch.bfloat16,False,True,asm,6,5,14.4132,_ZN5aiter48bf16gemm_fp32bf16_tn_64x64_bshuffle_splitk_cleanE,0.0159,155.83,809.5
256,416,384,7168,False,torch.bfloat16,torch.bfloat16,False,True,asm,6,5,14.4633,_ZN5aiter48bf16gemm_fp32bf16_tn_64x64_bshuffle_splitk_cleanE,0.016,158.34,815.05
256,424,384,7168,False,torch.bfloat16,torch.bfloat16,False,True,asm,6,5,14.5612,_ZN5aiter48bf16gemm_fp32bf16_tn_64x64_bshuffle_splitk_cleanE,0.016,160.3,817.87
256,432,384,7168,False,torch.bfloat16,torch.bfloat16,False,True,asm,6,5,14.5486,_ZN5aiter48bf16gemm_fp32bf16_tn_64x64_bshuffle_splitk_cleanE,0.0162,163.46,826.88
256,440,384,7168,False,torch.bfloat16,torch.bfloat16,False,True,asm,6,5,14.6392,_ZN5aiter48bf16gemm_fp32bf16_tn_64x64_bshuffle_splitk_cleanE,0.0162,165.46,830.02
256,448,384,7168,False,torch.bfloat16,torch.bfloat16,False,True,asm,6,5,14.8994,_ZN5aiter48bf16gemm_fp32bf16_tn_64x64_bshuffle_splitk_cleanE,0.0163,165.53,823.63
256,456,384,7168,False,torch.bfloat16,torch.bfloat16,False,True,asm,6,5,15.0627,_ZN5aiter48bf16gemm_fp32bf16_tn_64x64_bshuffle_splitk_cleanE,0.0162,166.66,822.72
256,464,384,7168,False,torch.bfloat16,torch.bfloat16,False,True,asm,6,5,14.9407,_ZN5aiter48bf16gemm_fp32bf16_tn_64x64_bshuffle_splitk_cleanE,0.016,170.96,837.53
256,472,384,7168,False,torch.bfloat16,torch.bfloat16,False,True,asm,6,5,15.2407,_ZN5aiter48bf16gemm_fp32bf16_tn_64x64_bshuffle_splitk_cleanE,0.0162,170.49,828.97
256,480,384,7168,False,torch.bfloat16,torch.bfloat16,False,True,asm,6,5,15.1161,_ZN5aiter48bf16gemm_fp32bf16_tn_64x64_bshuffle_splitk_cleanE,0.0162,174.81,843.8
256,488,384,7168,False,torch.bfloat16,torch.bfloat16,False,True,asm,6,5,15.3521,_ZN5aiter48bf16gemm_fp32bf16_tn_64x64_bshuffle_splitk_cleanE,0.0163,174.99,838.7
256,496,384,7168,False,torch.bfloat16,torch.bfloat16,False,True,asm,7,5,15.3309,_ZN5aiter48bf16gemm_fp32bf16_tn_80x64_bshuffle_splitk_cleanE,0.016,178.1,847.74
256,504,384,7168,False,torch.bfloat16,torch.bfloat16,False,True,asm,7,5,15.2826,_ZN5aiter48bf16gemm_fp32bf16_tn_80x64_bshuffle_splitk_cleanE,0.016,181.55,858.33
256,512,384,7168,False,torch.bfloat16,torch.bfloat16,False,True,asm,7,5,15.3848,_ZN5aiter48bf16gemm_fp32bf16_tn_80x64_bshuffle_splitk_cleanE,0.0163,183.21,860.48
256,1,1024,7168,False,torch.bfloat16,torch.bfloat16,False,True,asm,2,7,12.5935,_ZN5aiter48bf16gemm_fp32bf16_tn_32x64_bshuffle_splitk_cleanE,0.0234,1.17,1166.99
256,2,1024,7168,False,torch.bfloat16,torch.bfloat16,False,True,asm,2,7,12.442,_ZN5aiter48bf16gemm_fp32bf16_tn_32x64_bshuffle_splitk_cleanE,0.0161,2.36,1182.51
256,4,1024,7168,False,torch.bfloat16,torch.bfloat16,False,True,asm,2,7,12.4342,_ZN5aiter48bf16gemm_fp32bf16_tn_32x64_bshuffle_splitk_cleanE,0.0217,4.72,1185.89
256,8,1024,7168,False,torch.bfloat16,torch.bfloat16,False,True,asm,2,7,12.42,_ZN5aiter48bf16gemm_fp32bf16_tn_32x64_bshuffle_splitk_cleanE,0.0176,9.46,1192.52
256,16,1024,7168,False,torch.bfloat16,torch.bfloat16,False,True,asm,2,7,12.5694,_ZN5aiter48bf16gemm_fp32bf16_tn_32x64_bshuffle_splitk_cleanE,0.02,18.69,1188.78
256,24,1024,7168,False,torch.bfloat16,torch.bfloat16,False,True,asm,2,7,12.7162,_ZN5aiter48bf16gemm_fp32bf16_tn_32x64_bshuffle_splitk_cleanE,0.0199,27.71,1185.36
256,32,1024,7168,False,torch.bfloat16,torch.bfloat16,False,True,asm,2,7,12.7957,_ZN5aiter48bf16gemm_fp32bf16_tn_32x64_bshuffle_splitk_cleanE,0.0199,36.71,1188.24
256,40,1024,7168,False,torch.bfloat16,torch.bfloat16,False,True,asm,4,8,12.8999,_ZN5aiter48bf16gemm_fp32bf16_tn_48x64_bshuffle_splitk_cleanE,0.0212,45.52,1188.8
256,48,1024,7168,False,torch.bfloat16,torch.bfloat16,False,True,asm,2,6,12.9935,_ZN5aiter48bf16gemm_fp32bf16_tn_32x64_bshuffle_splitk_cleanE,0.0174,54.23,1190.33
256,56,1024,7168,False,torch.bfloat16,torch.bfloat16,False,True,asm,2,7,13.0694,_ZN5aiter48bf16gemm_fp32bf16_tn_32x64_bshuffle_splitk_cleanE,0.0199,62.9,1193.44
256,64,1024,7168,False,torch.bfloat16,torch.bfloat16,False,True,asm,2,6,13.0265,_ZN5aiter48bf16gemm_fp32bf16_tn_32x64_bshuffle_splitk_cleanE,0.0173,72.12,1207.43
256,72,1024,7168,False,torch.bfloat16,torch.bfloat16,False,True,asm,2,5,13.4646,_ZN5aiter48bf16gemm_fp32bf16_tn_32x64_bshuffle_splitk_cleanE,0.0157,78.5,1177.88
256,80,1024,7168,False,torch.bfloat16,torch.bfloat16,False,True,asm,2,5,13.3528,_ZN5aiter48bf16gemm_fp32bf16_tn_32x64_bshuffle_splitk_cleanE,0.0161,87.95,1197.56
256,88,1024,7168,False,torch.bfloat16,torch.bfloat16,False,True,asm,2,5,13.4839,_ZN5aiter48bf16gemm_fp32bf16_tn_32x64_bshuffle_splitk_cleanE,0.0163,95.81,1195.64
256,96,1024,7168,False,torch.bfloat16,torch.bfloat16,False,True,asm,2,5,13.4979,_ZN5aiter48bf16gemm_fp32bf16_tn_32x64_bshuffle_splitk_cleanE,0.0157,104.41,1204.11
256,104,1024,7168,False,torch.bfloat16,torch.bfloat16,False,True,asm,6,6,13.77,_ZN5aiter48bf16gemm_fp32bf16_tn_64x64_bshuffle_splitk_cleanE,0.0183,110.87,1189.83
256,112,1024,7168,False,torch.bfloat16,torch.bfloat16,False,True,asm,4,5,13.9019,_ZN5aiter48bf16gemm_fp32bf16_tn_48x64_bshuffle_splitk_cleanE,0.0156,118.27,1187.97
256,120,1024,7168,False,torch.bfloat16,torch.bfloat16,False,True,asm,4,5,14.0263,_ZN5aiter48bf16gemm_fp32bf16_tn_48x64_bshuffle_splitk_cleanE,0.0159,125.59,1186.78
256,128,1024,7168,False,torch.bfloat16,torch.bfloat16,False,True,asm,6,7,14.0691,_ZN5aiter48bf16gemm_fp32bf16_tn_64x64_bshuffle_splitk_cleanE,0.0202,133.56,1192.49
256,136,1024,7168,False,torch.bfloat16,torch.bfloat16,False,True,asm,4,5,14.0745,_ZN5aiter48bf16gemm_fp32bf16_tn_48x64_bshuffle_splitk_cleanE,0.0159,141.85,1201.34
256,144,1024,7168,False,torch.bfloat16,torch.bfloat16,False,True,asm,4,5,14.1456,_ZN5aiter48bf16gemm_fp32bf16_tn_48x64_bshuffle_splitk_cleanE,0.0161,149.44,1204.57
256,152,1024,7168,False,torch.bfloat16,torch.bfloat16,False,True,asm,6,5,14.6158,_ZN5aiter48bf16gemm_fp32bf16_tn_64x64_bshuffle_splitk_cleanE,0.0162,152.67,1174.79
256,160,1024,7168,False,torch.bfloat16,torch.bfloat16,False,True,asm,6,5,14.4588,_ZN5aiter48bf16gemm_fp32bf16_tn_64x64_bshuffle_splitk_cleanE,0.0161,162.45,1196.61
256,168,1024,7168,False,torch.bfloat16,torch.bfloat16,False,True,asm,6,5,14.4201,_ZN5aiter48bf16gemm_fp32bf16_tn_64x64_bshuffle_splitk_cleanE,0.0162,171.03,1208.91
256,176,1024,7168,False,torch.bfloat16,torch.bfloat16,False,True,asm,6,5,14.7825,_ZN5aiter48bf16gemm_fp32bf16_tn_64x64_bshuffle_splitk_cleanE,0.0163,174.78,1188.14
256,184,1024,7168,False,torch.bfloat16,torch.bfloat16,False,True,asm,6,5,14.7559,_ZN5aiter48bf16gemm_fp32bf16_tn_64x64_bshuffle_splitk_cleanE,0.016,183.05,1199.16
256,192,1024,7168,False,torch.bfloat16,torch.bfloat16,False,True,asm,6,5,14.8374,_ZN5aiter48bf16gemm_fp32bf16_tn_64x64_bshuffle_splitk_cleanE,0.016,189.96,1201.41
256,200,1024,7168,False,torch.bfloat16,torch.bfloat16,False,True,asm,7,5,15.0136,_ZN5aiter48bf16gemm_fp32bf16_tn_80x64_bshuffle_splitk_cleanE,0.0161,195.56,1196.04
256,208,1024,7168,False,torch.bfloat16,torch.bfloat16,False,True,asm,7,5,15.257,_ZN5aiter48bf16gemm_fp32bf16_tn_80x64_bshuffle_splitk_cleanE,0.0163,200.13,1185.55
256,216,1024,7168,False,torch.bfloat16,torch.bfloat16,False,True,asm,7,5,15.2531,_ZN5aiter48bf16gemm_fp32bf16_tn_80x64_bshuffle_splitk_cleanE,0.0161,207.89,1194.45
256,224,1024,7168,False,torch.bfloat16,torch.bfloat16,False,True,asm,7,5,15.2736,_ZN5aiter48bf16gemm_fp32bf16_tn_80x64_bshuffle_splitk_cleanE,0.0163,215.3,1201.42
256,232,1024,7168,False,torch.bfloat16,torch.bfloat16,False,True,asm,7,5,15.5654,_ZN5aiter48bf16gemm_fp32bf16_tn_80x64_bshuffle_splitk_cleanE,0.0162,218.8,1187.32
256,240,1024,7168,False,torch.bfloat16,torch.bfloat16,False,True,asm,7,5,15.6101,_ZN5aiter48bf16gemm_fp32bf16_tn_80x64_bshuffle_splitk_cleanE,0.0161,225.7,1192.32
256,248,1024,7168,False,torch.bfloat16,torch.bfloat16,False,True,asm,9,5,15.8878,_ZN5aiter48bf16gemm_fp32bf16_tn_96x64_bshuffle_splitk_cleanE,0.0161,229.15,1179.73
256,256,1024,7168,False,torch.bfloat16,torch.bfloat16,False,True,asm,9,5,15.9418,_ZN5aiter48bf16gemm_fp32bf16_tn_96x64_bshuffle_splitk_cleanE,0.0162,235.74,1183.95
256,264,1024,7168,False,torch.bfloat16,torch.bfloat16,False,True,asm,9,5,15.9483,_ZN5aiter48bf16gemm_fp32bf16_tn_96x64_bshuffle_splitk_cleanE,0.0161,243.01,1191.69
256,272,1024,7168,False,torch.bfloat16,torch.bfloat16,False,True,asm,9,5,16.056,_ZN5aiter48bf16gemm_fp32bf16_tn_96x64_bshuffle_splitk_cleanE,0.0162,248.69,1191.86
256,280,1024,7168,False,torch.bfloat16,torch.bfloat16,False,True,asm,9,5,16.1624,_ZN5aiter48bf16gemm_fp32bf16_tn_96x64_bshuffle_splitk_cleanE,0.0163,254.32,1192.12
256,288,1024,7168,False,torch.bfloat16,torch.bfloat16,False,True,asm,9,5,16.3742,_ZN5aiter48bf16gemm_fp32bf16_tn_96x64_bshuffle_splitk_cleanE,0.0163,258.2,1184.71
256,296,1024,7168,False,torch.bfloat16,torch.bfloat16,False,True,asm,7,4,16.8964,_ZN5aiter48bf16gemm_fp32bf16_tn_80x64_bshuffle_splitk_cleanE,0.0137,257.17,1155.85
256,304,1024,7168,False,torch.bfloat16,torch.bfloat16,False,True,asm,7,4,17.1481,_ZN5aiter48bf16gemm_fp32bf16_tn_80x64_bshuffle_splitk_cleanE,0.0138,260.25,1146.53
256,312,1024,7168,False,torch.bfloat16,torch.bfloat16,False,True,asm,7,4,17.171,_ZN5aiter48bf16gemm_fp32bf16_tn_80x64_bshuffle_splitk_cleanE,0.0137,266.74,1152.63
256,320,1024,7168,False,torch.bfloat16,torch.bfloat16,False,True,asm,7,4,17.2089,_ZN5aiter48bf16gemm_fp32bf16_tn_80x64_bshuffle_splitk_cleanE,0.0138,272.98,1157.71
256,328,1024,7168,False,torch.bfloat16,torch.bfloat16,False,True,asm,11,5,17.3748,_ZN5aiter49bf16gemm_fp32bf16_tn_128x64_bshuffle_splitk_cleanE,0.0161,277.13,1154.2
256,336,1024,7168,False,torch.bfloat16,torch.bfloat16,False,True,asm,11,5,17.5058,_ZN5aiter49bf16gemm_fp32bf16_tn_128x64_bshuffle_splitk_cleanE,0.0161,281.76,1153.05
256,344,1024,7168,False,torch.bfloat16,torch.bfloat16,False,True,asm,11,5,17.4502,_ZN5aiter49bf16gemm_fp32bf16_tn_128x64_bshuffle_splitk_cleanE,0.0163,289.39,1164.24
256,352,1024,7168,False,torch.bfloat16,torch.bfloat16,False,True,asm,11,5,17.6379,_ZN5aiter49bf16gemm_fp32bf16_tn_128x64_bshuffle_splitk_cleanE,0.0159,292.97,1159.28
256,360,1024,7168,False,torch.bfloat16,torch.bfloat16,False,True,asm,11,5,17.6523,_ZN5aiter49bf16gemm_fp32bf16_tn_128x64_bshuffle_splitk_cleanE,0.0161,299.38,1165.76
256,368,1024,7168,False,torch.bfloat16,torch.bfloat16,False,True,asm,11,5,17.9086,_ZN5aiter49bf16gemm_fp32bf16_tn_128x64_bshuffle_splitk_cleanE,0.0161,301.66,1156.39
256,376,1024,7168,False,torch.bfloat16,torch.bfloat16,False,True,asm,11,5,17.9783,_ZN5aiter49bf16gemm_fp32bf16_tn_128x64_bshuffle_splitk_cleanE,0.016,307.02,1159.2
256,384,1024,7168,False,torch.bfloat16,torch.bfloat16,False,True,asm,11,5,18.1712,_ZN5aiter49bf16gemm_fp32bf16_tn_128x64_bshuffle_splitk_cleanE,0.0162,310.22,1154.11
256,392,1024,7168,False,torch.bfloat16,torch.bfloat16,False,True,asm,13,5,19.2636,_ZN5aiter49bf16gemm_fp32bf16_tn_160x64_bshuffle_splitk_cleanE,0.0162,298.73,1095.46
256,400,1024,7168,False,torch.bfloat16,torch.bfloat16,False,True,asm,13,5,19.2925,_ZN5aiter49bf16gemm_fp32bf16_tn_160x64_bshuffle_splitk_cleanE,0.0162,304.37,1100.62
256,408,1024,7168,False,torch.bfloat16,torch.bfloat16,False,True,asm,13,5,19.3523,_ZN5aiter49bf16gemm_fp32bf16_tn_160x64_bshuffle_splitk_cleanE,0.0159,309.5,1103.99
256,416,1024,7168,False,torch.bfloat16,torch.bfloat16,False,True,asm,13,5,19.4425,_ZN5aiter49bf16gemm_fp32bf16_tn_160x64_bshuffle_splitk_cleanE,0.016,314.1,1105.61
256,424,1024,7168,False,torch.bfloat16,torch.bfloat16,False,True,asm,13,5,19.4543,_ZN5aiter49bf16gemm_fp32bf16_tn_160x64_bshuffle_splitk_cleanE,0.0161,319.95,1111.68
256,432,1024,7168,False,torch.bfloat16,torch.bfloat16,False,True,asm,13,5,19.6964,_ZN5aiter49bf16gemm_fp32bf16_tn_160x64_bshuffle_splitk_cleanE,0.016,321.98,1104.67
256,440,1024,7168,False,torch.bfloat16,torch.bfloat16,False,True,asm,13,5,19.7102,_ZN5aiter49bf16gemm_fp32bf16_tn_160x64_bshuffle_splitk_cleanE,0.0161,327.71,1110.54
256,448,1024,7168,False,torch.bfloat16,torch.bfloat16,False,True,asm,13,5,19.8319,_ZN5aiter49bf16gemm_fp32bf16_tn_160x64_bshuffle_splitk_cleanE,0.0161,331.62,1110.34
256,456,1024,7168,False,torch.bfloat16,torch.bfloat16,False,True,asm,13,5,20.0401,_ZN5aiter49bf16gemm_fp32bf16_tn_160x64_bshuffle_splitk_cleanE,0.0162,334.04,1105.34
256,464,1024,7168,False,torch.bfloat16,torch.bfloat16,False,True,asm,11,4,20.223,_ZN5aiter49bf16gemm_fp32bf16_tn_128x64_bshuffle_splitk_cleanE,0.0139,336.82,1101.83
256,472,1024,7168,False,torch.bfloat16,torch.bfloat16,False,True,asm,11,4,20.3469,_ZN5aiter49bf16gemm_fp32bf16_tn_128x64_bshuffle_splitk_cleanE,0.0137,340.54,1101.56
256,480,1024,7168,False,torch.bfloat16,torch.bfloat16,False,True,asm,11,4,20.4821,_ZN5aiter49bf16gemm_fp32bf16_tn_128x64_bshuffle_splitk_cleanE,0.0139,344.03,1100.69
256,488,1024,7168,False,torch.bfloat16,torch.bfloat16,False,True,asm,11,4,20.5673,_ZN5aiter49bf16gemm_fp32bf16_tn_128x64_bshuffle_splitk_cleanE,0.0138,348.31,1102.5
256,496,1024,7168,False,torch.bfloat16,torch.bfloat16,False,True,asm,11,4,20.864,_ZN5aiter49bf16gemm_fp32bf16_tn_128x64_bshuffle_splitk_cleanE,0.0139,348.99,1093.1
256,504,1024,7168,False,torch.bfloat16,torch.bfloat16,False,True,asm,11,4,20.9233,_ZN5aiter49bf16gemm_fp32bf16_tn_128x64_bshuffle_splitk_cleanE,0.0138,353.61,1096.27
256,512,1024,7168,False,torch.bfloat16,torch.bfloat16,False,True,asm,11,4,20.9974,_ZN5aiter49bf16gemm_fp32bf16_tn_128x64_bshuffle_splitk_cleanE,0.0139,357.96,1098.64
256,1,2112,7168,False,torch.bfloat16,torch.bfloat16,False,True,asm,2,6,13.2862,_ZN5aiter48bf16gemm_fp32bf16_tn_32x64_bshuffle_splitk_cleanE,0.0166,2.28,2280.28
256,2,2112,7168,False,torch.bfloat16,torch.bfloat16,False,True,asm,2,7,13.3499,_ZN5aiter48bf16gemm_fp32bf16_tn_32x64_bshuffle_splitk_cleanE,0.0161,4.54,2270.78
256,4,2112,7168,False,torch.bfloat16,torch.bfloat16,False,True,asm,2,6,13.3417,_ZN5aiter48bf16gemm_fp32bf16_tn_32x64_bshuffle_splitk_cleanE,0.0172,9.08,2274.96
256,8,2112,7168,False,torch.bfloat16,torch.bfloat16,False,True,asm,2,6,13.3978,_ZN5aiter48bf16gemm_fp32bf16_tn_32x64_bshuffle_splitk_cleanE,0.0176,18.08,2270.98
256,16,2112,7168,False,torch.bfloat16,torch.bfloat16,False,True,asm,2,6,13.5702,_ZN5aiter48bf16gemm_fp32bf16_tn_32x64_bshuffle_splitk_cleanE,0.0184,35.7,2253.07
256,24,2112,7168,False,torch.bfloat16,torch.bfloat16,False,True,asm,2,6,13.5852,_ZN5aiter48bf16gemm_fp32bf16_tn_32x64_bshuffle_splitk_cleanE,0.0187,53.49,2261.51
256,32,2112,7168,False,torch.bfloat16,torch.bfloat16,False,True,asm,2,6,13.927,_ZN5aiter48bf16gemm_fp32bf16_tn_32x64_bshuffle_splitk_cleanE,0.0184,69.57,2216.67
256,40,2112,7168,False,torch.bfloat16,torch.bfloat16,False,True,asm,4,6,14.3293,_ZN5aiter48bf16gemm_fp32bf16_tn_48x64_bshuffle_splitk_cleanE,0.0184,84.52,2164.8
256,48,2112,7168,False,torch.bfloat16,torch.bfloat16,False,True,asm,4,6,14.3165,_ZN5aiter48bf16gemm_fp32bf16_tn_48x64_bshuffle_splitk_cleanE,0.0178,101.51,2177.1
256,56,2112,7168,False,torch.bfloat16,torch.bfloat16,False,True,asm,6,6,14.6952,_ZN5aiter48bf16gemm_fp32bf16_tn_64x64_bshuffle_splitk_cleanE,0.0173,115.38,2131.1
256,64,2112,7168,False,torch.bfloat16,torch.bfloat16,False,True,asm,6,6,14.8863,_ZN5aiter48bf16gemm_fp32bf16_tn_64x64_bshuffle_splitk_cleanE,0.018,130.17,2113.72
256,72,2112,7168,False,torch.bfloat16,torch.bfloat16,False,True,asm,7,7,15.2992,_ZN5aiter48bf16gemm_fp32bf16_tn_80x64_bshuffle_splitk_cleanE,0.0195,142.49,2066.38
256,80,2112,7168,False,torch.bfloat16,torch.bfloat16,False,True,asm,7,6,15.2283,_ZN5aiter48bf16gemm_fp32bf16_tn_80x64_bshuffle_splitk_cleanE,0.018,159.06,2085.75
256,88,2112,7168,False,torch.bfloat16,torch.bfloat16,False,True,asm,9,6,15.8104,_ZN5aiter48bf16gemm_fp32bf16_tn_96x64_bshuffle_splitk_cleanE,0.018,168.52,2018.35
256,96,2112,7168,False,torch.bfloat16,torch.bfloat16,False,True,asm,9,6,15.8889,_ZN5aiter48bf16gemm_fp32bf16_tn_96x64_bshuffle_splitk_cleanE,0.018,182.94,2017.72
256,104,2112,7168,False,torch.bfloat16,torch.bfloat16,False,True,asm,11,7,16.4942,_ZN5aiter49bf16gemm_fp32bf16_tn_128x64_bshuffle_splitk_cleanE,0.0198,190.91,1952.68
256,112,2112,7168,False,torch.bfloat16,torch.bfloat16,False,True,asm,11,7,16.2866,_ZN5aiter49bf16gemm_fp32bf16_tn_128x64_bshuffle_splitk_cleanE,0.0197,208.21,1986.69
256,120,2112,7168,False,torch.bfloat16,torch.bfloat16,False,True,asm,11,7,16.8719,_ZN5aiter49bf16gemm_fp32bf16_tn_128x64_bshuffle_splitk_cleanE,0.0197,215.35,1926.57
256,128,2112,7168,False,torch.bfloat16,torch.bfloat16,False,True,asm,11,7,16.9908,_ZN5aiter49bf16gemm_fp32bf16_tn_128x64_bshuffle_splitk_cleanE,0.0197,228.1,1921.82
256,136,2112,7168,False,torch.bfloat16,torch.bfloat16,False,True,asm,13,7,17.5481,_ZN5aiter49bf16gemm_fp32bf16_tn_160x64_bshuffle_splitk_cleanE,0.0201,234.66,1869.25
256,144,2112,7168,False,torch.bfloat16,torch.bfloat16,False,True,asm,13,7,17.5474,_ZN5aiter49bf16gemm_fp32bf16_tn_160x64_bshuffle_splitk_cleanE,0.0196,248.47,1877.79
256,152,2112,7168,False,torch.bfloat16,torch.bfloat16,False,True,asm,13,7,17.9127,_ZN5aiter49bf16gemm_fp32bf16_tn_160x64_bshuffle_splitk_cleanE,0.0197,256.92,1847.78
256,160,2112,7168,False,torch.bfloat16,torch.bfloat16,False,True,asm,13,7,18.2549,_ZN5aiter49bf16gemm_fp32bf16_tn_160x64_bshuffle_splitk_cleanE,0.02,265.38,1821.28
256,168,2112,7168,False,torch.bfloat16,torch.bfloat16,False,True,asm,9,3,20.4667,_ZN5aiter48bf16gemm_fp32bf16_tn_96x64_bshuffle_splitk_cleanE,0.0107,248.53,1631.71
256,176,2112,7168,False,torch.bfloat16,torch.bfloat16,False,True,asm,9,3,20.7792,_ZN5aiter48bf16gemm_fp32bf16_tn_96x64_bshuffle_splitk_cleanE,0.0107,256.45,1614.32
256,184,2112,7168,False,torch.bfloat16,torch.bfloat16,False,True,asm,9,3,21.1144,_ZN5aiter48bf16gemm_fp32bf16_tn_96x64_bshuffle_splitk_cleanE,0.0107,263.85,1595.72
256,192,2112,7168,False,torch.bfloat16,torch.bfloat16,False,True,asm,9,3,21.2975,_ZN5aiter48bf16gemm_fp32bf16_tn_96x64_bshuffle_splitk_cleanE,0.0106,272.96,1588.97
256,200,2112,7168,False,torch.bfloat16,torch.bfloat16,False,True,asm,11,3,22.7883,_ZN5aiter49bf16gemm_fp32bf16_tn_128x64_bshuffle_splitk_cleanE,0.0106,265.73,1491.54
256,208,2112,7168,False,torch.bfloat16,torch.bfloat16,False,True,asm,11,3,22.7372,_ZN5aiter49bf16gemm_fp32bf16_tn_128x64_bshuffle_splitk_cleanE,0.0105,276.98,1501.42
256,216,2112,7168,False,torch.bfloat16,torch.bfloat16,False,True,asm,11,3,22.9292,_ZN5aiter49bf16gemm_fp32bf16_tn_128x64_bshuffle_splitk_cleanE,0.0106,285.22,1495.32
256,224,2112,7168,False,torch.bfloat16,torch.bfloat16,False,True,asm,11,3,23.0335,_ZN5aiter49bf16gemm_fp32bf16_tn_128x64_bshuffle_splitk_cleanE,0.0106,294.45,1495.0
256,232,2112,7168,False,torch.bfloat16,torch.bfloat16,False,True,asm,11,3,23.0742,_ZN5aiter49bf16gemm_fp32bf16_tn_128x64_bshuffle_splitk_cleanE,0.0106,304.43,1498.8
256,240,2112,7168,False,torch.bfloat16,torch.bfloat16,False,True,asm,11,3,23.4831,_ZN5aiter49bf16gemm_fp32bf16_tn_128x64_bshuffle_splitk_cleanE,0.0106,309.44,1479.02
256,248,2112,7168,False,torch.bfloat16,torch.bfloat16,False,True,asm,11,3,23.8451,_ZN5aiter49bf16gemm_fp32bf16_tn_128x64_bshuffle_splitk_cleanE,0.0106,314.9,1462.8
256,256,2112,7168,False,torch.bfloat16,torch.bfloat16,False,True,asm,11,3,23.9404,_ZN5aiter49bf16gemm_fp32bf16_tn_128x64_bshuffle_splitk_cleanE,0.0106,323.77,1463.17
256,264,2112,7168,False,torch.bfloat16,torch.bfloat16,False,True,asm,13,3,25.6202,_ZN5aiter49bf16gemm_fp32bf16_tn_160x64_bshuffle_splitk_cleanE,0.0106,311.99,1373.04
256,272,2112,7168,False,torch.bfloat16,torch.bfloat16,False,True,asm,13,3,25.6101,_ZN5aiter49bf16gemm_fp32bf16_tn_160x64_bshuffle_splitk_cleanE,0.0106,321.57,1379.38
256,280,2112,7168,False,torch.bfloat16,torch.bfloat16,False,True,asm,13,3,25.8388,_ZN5aiter49bf16gemm_fp32bf16_tn_160x64_bshuffle_splitk_cleanE,0.0107,328.1,1372.91
256,288,2112,7168,False,torch.bfloat16,torch.bfloat16,False,True,asm,13,3,26.0397,_ZN5aiter49bf16gemm_fp32bf16_tn_160x64_bshuffle_splitk_cleanE,0.0107,334.87,1368.02
256,296,2112,7168,False,torch.bfloat16,torch.bfloat16,False,True,asm,13,3,26.2529,_ZN5aiter49bf16gemm_fp32bf16_tn_160x64_bshuffle_splitk_cleanE,0.0105,341.38,1362.57
256,304,2112,7168,False,torch.bfloat16,torch.bfloat16,False,True,asm,13,3,26.6671,_ZN5aiter49bf16gemm_fp32bf16_tn_160x64_bshuffle_splitk_cleanE,0.0105,345.16,1346.97
256,312,2112,7168,False,torch.bfloat16,torch.bfloat16,False,True,asm,13,3,26.9281,_ZN5aiter49bf16gemm_fp32bf16_tn_160x64_bshuffle_splitk_cleanE,0.0105,350.81,1339.43
256,320,2112,7168,False,torch.bfloat16,torch.bfloat16,False,True,asm,13,3,27.3648,_ZN5aiter49bf16gemm_fp32bf16_tn_160x64_bshuffle_splitk_cleanE,0.0105,354.06,1323.48
256,328,2112,7168,False,torch.bfloat16,torch.bfloat16,False,True,asm,11,2,30.7504,_ZN5aiter49bf16gemm_fp32bf16_tn_128x64_bshuffle_splitk_cleanE,0.006,322.96,1182.6
256,336,2112,7168,False,torch.bfloat16,torch.bfloat16,False,True,asm,11,2,30.5685,_ZN5aiter49bf16gemm_fp32bf16_tn_128x64_bshuffle_splitk_cleanE,0.006,332.8,1194.49
256,344,2112,7168,False,torch.bfloat16,torch.bfloat16,False,True,asm,11,2,30.7808,_ZN5aiter49bf16gemm_fp32bf16_tn_128x64_bshuffle_splitk_cleanE,0.006,338.38,1191.08
256,352,2112,7168,False,torch.bfloat16,torch.bfloat16,False,True,asm,11,2,30.9766,_ZN5aiter49bf16gemm_fp32bf16_tn_128x64_bshuffle_splitk_cleanE,0.0061,344.06,1188.34
256,360,2112,7168,False,torch.bfloat16,torch.bfloat16,False,True,asm,11,2,30.9194,_ZN5aiter49bf16gemm_fp32bf16_tn_128x64_bshuffle_splitk_cleanE,0.0061,352.53,1195.34
256,368,2112,7168,False,torch.bfloat16,torch.bfloat16,False,True,asm,11,2,31.2067,_ZN5aiter49bf16gemm_fp32bf16_tn_128x64_bshuffle_splitk_cleanE,0.0061,357.04,1189.09
256,376,2112,7168,False,torch.bfloat16,torch.bfloat16,False,True,asm,11,2,31.6891,_ZN5aiter49bf16gemm_fp32bf16_tn_128x64_bshuffle_splitk_cleanE,0.0061,359.25,1175.68
256,384,2112,7168,False,torch.bfloat16,torch.bfloat16,False,True,asm,11,2,31.7971,_ZN5aiter49bf16gemm_fp32bf16_tn_128x64_bshuffle_splitk_cleanE,0.0061,365.65,1176.35
256,392,2112,7168,False,torch.bfloat16,torch.bfloat16,False,True,asm,13,2,35.5533,_ZN5aiter49bf16gemm_fp32bf16_tn_160x64_bshuffle_splitk_cleanE,0.0061,333.83,1056.25
256,400,2112,7168,False,torch.bfloat16,torch.bfloat16,False,True,asm,13,2,35.0674,_ZN5aiter49bf16gemm_fp32bf16_tn_160x64_bshuffle_splitk_cleanE,0.0061,345.37,1075.12
256,408,2112,7168,False,torch.bfloat16,torch.bfloat16,False,True,asm,13,2,35.6292,_ZN5aiter49bf16gemm_fp32bf16_tn_160x64_bshuffle_splitk_cleanE,0.0061,346.72,1062.33
256,416,2112,7168,False,torch.bfloat16,torch.bfloat16,False,True,asm,13,2,35.2662,_ZN5aiter49bf16gemm_fp32bf16_tn_160x64_bshuffle_splitk_cleanE,0.0061,357.15,1077.48
256,424,2112,7168,False,torch.bfloat16,torch.bfloat16,False,True,asm,13,2,35.3268,_ZN5aiter49bf16gemm_fp32bf16_tn_160x64_bshuffle_splitk_cleanE,0.0061,363.4,1079.83
256,432,2112,7168,False,torch.bfloat16,torch.bfloat16,False,True,asm,13,2,35.3401,_ZN5aiter49bf16gemm_fp32bf16_tn_160x64_bshuffle_splitk_cleanE,0.0061,370.12,1083.63
256,440,2112,7168,False,torch.bfloat16,torch.bfloat16,False,True,asm,13,2,35.378,_ZN5aiter49bf16gemm_fp32bf16_tn_160x64_bshuffle_splitk_cleanE,0.0061,376.57,1086.66
256,448,2112,7168,False,torch.bfloat16,torch.bfloat16,False,True,asm,13,2,35.387,_ZN5aiter49bf16gemm_fp32bf16_tn_160x64_bshuffle_splitk_cleanE,0.0061,383.32,1090.58
256,456,2112,7168,False,torch.bfloat16,torch.bfloat16,False,True,asm,13,2,35.4743,_ZN5aiter49bf16gemm_fp32bf16_tn_160x64_bshuffle_splitk_cleanE,0.006,389.2,1092.09
256,464,2112,7168,False,torch.bfloat16,torch.bfloat16,False,True,asm,13,2,36.876,_ZN5aiter49bf16gemm_fp32bf16_tn_160x64_bshuffle_splitk_cleanE,0.006,380.97,1054.6
256,472,2112,7168,False,torch.bfloat16,torch.bfloat16,False,True,asm,13,2,36.2646,_ZN5aiter49bf16gemm_fp32bf16_tn_160x64_bshuffle_splitk_cleanE,0.006,394.08,1076.48
256,480,2112,7168,False,torch.bfloat16,torch.bfloat16,False,True,asm,13,2,37.0761,_ZN5aiter49bf16gemm_fp32bf16_tn_160x64_bshuffle_splitk_cleanE,0.006,391.98,1056.92
256,488,2112,7168,False,torch.bfloat16,torch.bfloat16,False,True,asm,8,1,47.0157,_ZN5aiter42bf16gemm_fp32bf16_tn_96x64_bshuffle_splitkE,0.0,314.27,836.63
256,496,2112,7168,False,torch.bfloat16,torch.bfloat16,False,True,asm,8,1,46.7123,_ZN5aiter42bf16gemm_fp32bf16_tn_96x64_bshuffle_splitkE,0.0,321.49,845.25
256,504,2112,7168,False,torch.bfloat16,torch.bfloat16,False,True,asm,8,1,47.2338,_ZN5aiter42bf16gemm_fp32bf16_tn_96x64_bshuffle_splitkE,0.0,323.07,839.06
256,512,2112,7168,False,torch.bfloat16,torch.bfloat16,False,True,asm,8,1,47.224,_ZN5aiter42bf16gemm_fp32bf16_tn_96x64_bshuffle_splitkE,0.0,328.27,842.38
256,1,3072,1536,False,torch.bfloat16,torch.bfloat16,False,True,asm,2,3,7.9974,_ZN5aiter48bf16gemm_fp32bf16_tn_32x64_bshuffle_splitk_cleanE,0.0046,1.18,1181.18
256,2,3072,1536,False,torch.bfloat16,torch.bfloat16,False,True,asm,2,3,8.0119,_ZN5aiter48bf16gemm_fp32bf16_tn_32x64_bshuffle_splitk_cleanE,0.005,2.36,1180.2
256,4,3072,1536,False,torch.bfloat16,torch.bfloat16,False,True,asm,2,3,8.0742,_ZN5aiter48bf16gemm_fp32bf16_tn_32x64_bshuffle_splitk_cleanE,0.0053,4.68,1173.37
256,8,3072,1536,False,torch.bfloat16,torch.bfloat16,False,True,asm,2,3,7.8645,_ZN5aiter48bf16gemm_fp32bf16_tn_32x64_bshuffle_splitk_cleanE,0.0054,9.6,1209.35
256,16,3072,1536,False,torch.bfloat16,torch.bfloat16,False,True,asm,2,3,8.1937,_ZN5aiter48bf16gemm_fp32bf16_tn_32x64_bshuffle_splitk_cleanE,0.0055,18.43,1169.76
256,24,3072,1536,False,torch.bfloat16,torch.bfloat16,False,True,asm,2,3,8.2819,_ZN5aiter48bf16gemm_fp32bf16_tn_32x64_bshuffle_splitk_cleanE,0.0055,27.35,1166.2
256,32,3072,1536,False,torch.bfloat16,torch.bfloat16,False,True,asm,2,3,8.3383,_ZN5aiter48bf16gemm_fp32bf16_tn_32x64_bshuffle_splitk_cleanE,0.0056,36.22,1167.16
256,40,3072,1536,False,torch.bfloat16,torch.bfloat16,False,True,asm,4,3,8.6924,_ZN5aiter48bf16gemm_fp32bf16_tn_48x64_bshuffle_splitk_cleanE,0.0056,43.43,1128.09
256,48,3072,1536,False,torch.bfloat16,torch.bfloat16,False,True,asm,4,3,8.577,_ZN5aiter48bf16gemm_fp32bf16_tn_48x64_bshuffle_splitk_cleanE,0.0058,52.81,1151.87
256,56,3072,1536,False,torch.bfloat16,torch.bfloat16,False,True,asm,6,3,9.0448,_ZN5aiter48bf16gemm_fp32bf16_tn_64x64_bshuffle_splitk_cleanE,0.0058,58.43,1100.44
256,64,3072,1536,False,torch.bfloat16,torch.bfloat16,False,True,asm,6,3,8.9142,_ZN5aiter48bf16gemm_fp32bf16_tn_64x64_bshuffle_splitk_cleanE,0.0057,67.75,1124.84
256,72,3072,1536,False,torch.bfloat16,torch.bfloat16,False,True,asm,9,4,9.3906,_ZN5aiter48bf16gemm_fp32bf16_tn_96x64_bshuffle_splitk_cleanE,0.0079,72.36,1075.62
256,80,3072,1536,False,torch.bfloat16,torch.bfloat16,False,True,asm,7,4,9.4011,_ZN5aiter48bf16gemm_fp32bf16_tn_80x64_bshuffle_splitk_cleanE,0.0078,80.31,1082.26
256,88,3072,1536,False,torch.bfloat16,torch.bfloat16,False,True,asm,6,2,9.5574,_ZN5aiter48bf16gemm_fp32bf16_tn_64x64_bshuffle_splitk_cleanE,0.0027,86.89,1072.28
256,96,3072,1536,False,torch.bfloat16,torch.bfloat16,False,True,asm,9,3,9.5251,_ZN5aiter48bf16gemm_fp32bf16_tn_96x64_bshuffle_splitk_cleanE,0.0057,95.11,1083.65
256,104,3072,1536,False,torch.bfloat16,torch.bfloat16,False,True,asm,6,2,9.8615,_ZN5aiter48bf16gemm_fp32bf16_tn_64x64_bshuffle_splitk_cleanE,0.0028,99.53,1054.16
256,112,3072,1536,False,torch.bfloat16,torch.bfloat16,False,True,asm,6,2,9.8795,_ZN5aiter48bf16gemm_fp32bf16_tn_64x64_bshuffle_splitk_cleanE,0.0028,106.99,1059.71
256,120,3072,1536,False,torch.bfloat16,torch.bfloat16,False,True,asm,6,2,9.8906,_ZN5aiter48bf16gemm_fp32bf16_tn_64x64_bshuffle_splitk_cleanE,0.0028,114.5,1065.97
256,128,3072,1536,False,torch.bfloat16,torch.bfloat16,False,True,asm,6,2,9.7447,_ZN5aiter48bf16gemm_fp32bf16_tn_64x64_bshuffle_splitk_cleanE,0.0028,123.96,1089.5
256,136,3072,1536,False,torch.bfloat16,torch.bfloat16,False,True,asm,7,2,10.2178,_ZN5aiter48bf16gemm_fp32bf16_tn_80x64_bshuffle_splitk_cleanE,0.0028,125.61,1046.27
256,144,3072,1536,False,torch.bfloat16,torch.bfloat16,False,True,asm,9,2,10.5815,_ZN5aiter48bf16gemm_fp32bf16_tn_96x64_bshuffle_splitk_cleanE,0.0027,128.43,1017.27
256,152,3072,1536,False,torch.bfloat16,torch.bfloat16,False,True,asm,7,2,10.4536,_ZN5aiter48bf16gemm_fp32bf16_tn_80x64_bshuffle_splitk_cleanE,0.0028,137.22,1036.77
256,160,3072,1536,False,torch.bfloat16,torch.bfloat16,False,True,asm,1,1,10.4894,_ZN5aiter42bf16gemm_fp32bf16_tn_32x64_bshuffle_splitkE,0.0,143.95,1040.26
256,168,3072,1536,False,torch.bfloat16,torch.bfloat16,False,True,asm,9,2,10.8399,_ZN5aiter48bf16gemm_fp32bf16_tn_96x64_bshuffle_splitk_cleanE,0.0028,146.26,1013.43
256,176,3072,1536,False,torch.bfloat16,torch.bfloat16,False,True,asm,9,2,11.3416,_ZN5aiter48bf16gemm_fp32bf16_tn_96x64_bshuffle_splitk_cleanE,0.0028,146.45,975.1
256,184,3072,1536,False,torch.bfloat16,torch.bfloat16,False,True,asm,9,2,11.2607,_ZN5aiter48bf16gemm_fp32bf16_tn_96x64_bshuffle_splitk_cleanE,0.0028,154.2,988.65
256,192,3072,1536,False,torch.bfloat16,torch.bfloat16,False,True,asm,3,1,10.9441,_ZN5aiter42bf16gemm_fp32bf16_tn_48x64_bshuffle_splitkE,0.0,165.56,1023.99
256,200,3072,1536,False,torch.bfloat16,torch.bfloat16,False,True,asm,5,1,11.3761,_ZN5aiter42bf16gemm_fp32bf16_tn_64x64_bshuffle_splitkE,0.0,165.91,991.59
256,208,3072,1536,False,torch.bfloat16,torch.bfloat16,False,True,asm,3,1,11.3021,_ZN5aiter42bf16gemm_fp32bf16_tn_48x64_bshuffle_splitkE,0.0,173.68,1004.6
256,216,3072,1536,False,torch.bfloat16,torch.bfloat16,False,True,asm,3,1,11.3483,_ZN5aiter42bf16gemm_fp32bf16_tn_48x64_bshuffle_splitkE,0.0,179.62,1007.01
256,224,3072,1536,False,torch.bfloat16,torch.bfloat16,False,True,asm,3,1,11.6382,_ZN5aiter42bf16gemm_fp32bf16_tn_48x64_bshuffle_splitkE,0.0,181.64,988.26
256,232,3072,1536,False,torch.bfloat16,torch.bfloat16,False,True,asm,3,1,11.2542,_ZN5aiter42bf16gemm_fp32bf16_tn_48x64_bshuffle_splitkE,0.0,194.54,1028.53
256,240,3072,1536,False,torch.bfloat16,torch.bfloat16,False,True,asm,3,1,11.7627,_ZN5aiter42bf16gemm_fp32bf16_tn_48x64_bshuffle_splitkE,0.0,192.55,990.34
256,248,3072,1536,False,torch.bfloat16,torch.bfloat16,False,True,asm,5,1,11.4852,_ZN5aiter42bf16gemm_fp32bf16_tn_64x64_bshuffle_splitkE,0.0,203.78,1020.68
256,256,3072,1536,False,torch.bfloat16,torch.bfloat16,False,True,asm,5,1,11.5472,_ZN5aiter42bf16gemm_fp32bf16_tn_64x64_bshuffle_splitkE,0.0,209.22,1021.59
256,264,3072,1536,False,torch.bfloat16,torch.bfloat16,False,True,asm,5,1,11.5207,_ZN5aiter42bf16gemm_fp32bf16_tn_64x64_bshuffle_splitkE,0.0,216.26,1030.34
256,272,3072,1536,False,torch.bfloat16,torch.bfloat16,False,True,asm,5,1,12.4375,_ZN5aiter42bf16gemm_fp32bf16_tn_64x64_bshuffle_splitkE,0.0,206.39,960.32
256,280,3072,1536,False,torch.bfloat16,torch.bfloat16,False,True,asm,5,1,12.027,_ZN5aiter42bf16gemm_fp32bf16_tn_64x64_bshuffle_splitkE,0.0,219.71,999.22
256,288,3072,1536,False,torch.bfloat16,torch.bfloat16,False,True,asm,5,1,11.9821,_ZN5aiter42bf16gemm_fp32bf16_tn_64x64_bshuffle_splitkE,0.0,226.83,1009.12
256,296,3072,1536,False,torch.bfloat16,torch.bfloat16,False,True,asm,5,1,11.7328,_ZN5aiter42bf16gemm_fp32bf16_tn_64x64_bshuffle_splitkE,0.0,238.09,1036.85
256,304,3072,1536,False,torch.bfloat16,torch.bfloat16,False,True,asm,5,1,12.168,_ZN5aiter42bf16gemm_fp32bf16_tn_64x64_bshuffle_splitkE,0.0,235.77,1005.82
256,312,3072,1536,False,torch.bfloat16,torch.bfloat16,False,True,asm,5,1,12.1486,_ZN5aiter42bf16gemm_fp32bf16_tn_64x64_bshuffle_splitkE,0.0,242.37,1013.5
256,320,3072,1536,False,torch.bfloat16,torch.bfloat16,False,True,asm,5,1,11.6335,_ZN5aiter42bf16gemm_fp32bf16_tn_64x64_bshuffle_splitkE,0.0,259.59,1064.71
256,328,3072,1536,False,torch.bfloat16,torch.bfloat16,False,True,asm,8,1,13.0128,_ZN5aiter42bf16gemm_fp32bf16_tn_96x64_bshuffle_splitkE,0.0,237.87,957.52
256,336,3072,1536,False,torch.bfloat16,torch.bfloat16,False,True,asm,8,1,13.1191,_ZN5aiter42bf16gemm_fp32bf16_tn_96x64_bshuffle_splitkE,0.0,241.7,955.38
256,344,3072,1536,False,torch.bfloat16,torch.bfloat16,False,True,asm,8,1,13.089,_ZN5aiter42bf16gemm_fp32bf16_tn_96x64_bshuffle_splitkE,0.0,248.02,963.21
256,352,3072,1536,False,torch.bfloat16,torch.bfloat16,False,True,asm,8,1,12.8432,_ZN5aiter42bf16gemm_fp32bf16_tn_96x64_bshuffle_splitkE,0.0,258.65,987.39
256,360,3072,1536,False,torch.bfloat16,torch.bfloat16,False,True,asm,8,1,12.9001,_ZN5aiter42bf16gemm_fp32bf16_tn_96x64_bshuffle_splitkE,0.0,263.36,988.75
256,368,3072,1536,False,torch.bfloat16,torch.bfloat16,False,True,asm,8,1,12.9064,_ZN5aiter42bf16gemm_fp32bf16_tn_96x64_bshuffle_splitkE,0.0,269.08,993.98
256,376,3072,1536,False,torch.bfloat16,torch.bfloat16,False,True,asm,8,1,13.3037,_ZN5aiter42bf16gemm_fp32bf16_tn_96x64_bshuffle_splitkE,0.0,266.72,969.84
256,384,3072,1536,False,torch.bfloat16,torch.bfloat16,False,True,asm,8,1,13.0204,_ZN5aiter42bf16gemm_fp32bf16_tn_96x64_bshuffle_splitkE,0.0,278.32,996.6
256,392,3072,1536,False,torch.bfloat16,torch.bfloat16,False,True,asm,8,1,13.3141,_ZN5aiter42bf16gemm_fp32bf16_tn_96x64_bshuffle_splitkE,0.0,277.85,980.15
256,400,3072,1536,False,torch.bfloat16,torch.bfloat16,False,True,asm,8,1,13.2954,_ZN5aiter42bf16gemm_fp32bf16_tn_96x64_bshuffle_splitkE,0.0,283.92,987.08
256,408,3072,1536,False,torch.bfloat16,torch.bfloat16,False,True,asm,8,1,13.7309,_ZN5aiter42bf16gemm_fp32bf16_tn_96x64_bshuffle_splitkE,0.0,280.42,961.14
256,416,3072,1536,False,torch.bfloat16,torch.bfloat16,False,True,asm,8,1,13.0842,_ZN5aiter42bf16gemm_fp32bf16_tn_96x64_bshuffle_splitkE,0.0,300.05,1014.28
256,424,3072,1536,False,torch.bfloat16,torch.bfloat16,False,True,asm,8,1,13.4377,_ZN5aiter42bf16gemm_fp32bf16_tn_96x64_bshuffle_splitkE,0.0,297.77,993.08
256,432,3072,1536,False,torch.bfloat16,torch.bfloat16,False,True,asm,8,1,13.2786,_ZN5aiter42bf16gemm_fp32bf16_tn_96x64_bshuffle_splitkE,0.0,307.03,1010.54
256,440,3072,1536,False,torch.bfloat16,torch.bfloat16,False,True,asm,8,1,13.466,_ZN5aiter42bf16gemm_fp32bf16_tn_96x64_bshuffle_splitkE,0.0,308.36,1001.95
256,448,3072,1536,False,torch.bfloat16,torch.bfloat16,False,True,asm,8,1,13.13,_ZN5aiter42bf16gemm_fp32bf16_tn_96x64_bshuffle_splitkE,0.0,322.0,1033.2
256,456,3072,1536,False,torch.bfloat16,torch.bfloat16,False,True,asm,8,1,13.4443,_ZN5aiter42bf16gemm_fp32bf16_tn_96x64_bshuffle_splitkE,0.0,320.09,1014.53
256,464,3072,1536,False,torch.bfloat16,torch.bfloat16,False,True,asm,8,1,13.5656,_ZN5aiter42bf16gemm_fp32bf16_tn_96x64_bshuffle_splitkE,0.0,322.79,1010.9
256,472,3072,1536,False,torch.bfloat16,torch.bfloat16,False,True,asm,8,1,13.5221,_ZN5aiter42bf16gemm_fp32bf16_tn_96x64_bshuffle_splitkE,0.0,329.41,1019.6
256,480,3072,1536,False,torch.bfloat16,torch.bfloat16,False,True,asm,8,1,13.2465,_ZN5aiter42bf16gemm_fp32bf16_tn_96x64_bshuffle_splitkE,0.0,341.97,1046.38
256,488,3072,1536,False,torch.bfloat16,torch.bfloat16,False,True,asm,10,1,15.1009,_ZN5aiter43bf16gemm_fp32bf16_tn_128x64_bshuffle_splitkE,0.0,304.97,922.77
256,496,3072,1536,False,torch.bfloat16,torch.bfloat16,False,True,asm,10,1,15.0372,_ZN5aiter43bf16gemm_fp32bf16_tn_128x64_bshuffle_splitkE,0.0,311.28,931.58
256,504,3072,1536,False,torch.bfloat16,torch.bfloat16,False,True,asm,10,1,15.101,_ZN5aiter43bf16gemm_fp32bf16_tn_128x64_bshuffle_splitkE,0.0,314.97,932.52
256,512,3072,1536,False,torch.bfloat16,torch.bfloat16,False,True,asm,10,1,15.195,_ZN5aiter43bf16gemm_fp32bf16_tn_128x64_bshuffle_splitkE,0.0,317.99,931.61
256,1,4096,512,False,torch.bfloat16,torch.bfloat16,False,True,asm,3,1,5.495,_ZN5aiter42bf16gemm_fp32bf16_tn_48x64_bshuffle_splitkE,0.0,0.76,764.97
256,2,4096,512,False,torch.bfloat16,torch.bfloat16,False,True,asm,1,1,5.4692,_ZN5aiter42bf16gemm_fp32bf16_tn_32x64_bshuffle_splitkE,0.0,1.53,770.27
256,4,4096,512,False,torch.bfloat16,torch.bfloat16,False,True,asm,1,1,5.4977,_ZN5aiter42bf16gemm_fp32bf16_tn_32x64_bshuffle_splitkE,0.0,3.05,769.63
256,8,4096,512,False,torch.bfloat16,torch.bfloat16,False,True,asm,1,1,5.5427,_ZN5aiter42bf16gemm_fp32bf16_tn_32x64_bshuffle_splitkE,0.0,6.05,770.03
256,16,4096,512,False,torch.bfloat16,torch.bfloat16,False,True,asm,1,1,6.1335,_ZN5aiter42bf16gemm_fp32bf16_tn_32x64_bshuffle_splitkE,0.0,10.94,707.88
256,24,4096,512,False,torch.bfloat16,torch.bfloat16,False,True,asm,1,1,5.6689,_ZN5aiter42bf16gemm_fp32bf16_tn_32x64_bshuffle_splitkE,0.0,17.76,778.9
256,32,4096,512,False,torch.bfloat16,torch.bfloat16,False,True,asm,1,1,5.6754,_ZN5aiter42bf16gemm_fp32bf16_tn_32x64_bshuffle_splitkE,0.0,23.65,791.0
256,40,4096,512,False,torch.bfloat16,torch.bfloat16,False,True,asm,1,1,5.6758,_ZN5aiter42bf16gemm_fp32bf16_tn_32x64_bshuffle_splitkE,0.0,29.56,803.93
256,48,4096,512,False,torch.bfloat16,torch.bfloat16,False,True,asm,1,1,5.6758,_ZN5aiter42bf16gemm_fp32bf16_tn_32x64_bshuffle_splitkE,0.0,35.47,816.92
256,56,4096,512,False,torch.bfloat16,torch.bfloat16,False,True,asm,3,1,5.8636,_ZN5aiter42bf16gemm_fp32bf16_tn_48x64_bshuffle_splitkE,0.0,40.06,803.33
256,64,4096,512,False,torch.bfloat16,torch.bfloat16,False,True,asm,1,1,5.6791,_ZN5aiter42bf16gemm_fp32bf16_tn_32x64_bshuffle_splitkE,0.0,47.27,842.41
256,72,4096,512,False,torch.bfloat16,torch.bfloat16,False,True,asm,1,1,5.7195,_ZN5aiter42bf16gemm_fp32bf16_tn_32x64_bshuffle_splitkE,0.0,52.8,849.35
256,80,4096,512,False,torch.bfloat16,torch.bfloat16,False,True,asm,1,1,6.3037,_ZN5aiter42bf16gemm_fp32bf16_tn_32x64_bshuffle_splitkE,0.0,53.23,782.33
256,88,4096,512,False,torch.bfloat16,torch.bfloat16,False,True,asm,1,1,5.7441,_ZN5aiter42bf16gemm_fp32bf16_tn_32x64_bshuffle_splitkE,0.0,64.26,871.38
256,96,4096,512,False,torch.bfloat16,torch.bfloat16,False,True,asm,1,1,6.3611,_ZN5aiter42bf16gemm_fp32bf16_tn_32x64_bshuffle_splitkE,0.0,63.3,798.45
256,104,4096,512,False,torch.bfloat16,torch.bfloat16,False,True,asm,1,1,5.7817,_ZN5aiter42bf16gemm_fp32bf16_tn_32x64_bshuffle_splitkE,0.0,75.45,891.22
256,112,4096,512,False,torch.bfloat16,torch.bfloat16,False,True,asm,1,1,5.8207,_ZN5aiter42bf16gemm_fp32bf16_tn_32x64_bshuffle_splitkE,0.0,80.71,897.92
256,120,4096,512,False,torch.bfloat16,torch.bfloat16,False,True,asm,1,1,5.7923,_ZN5aiter42bf16gemm_fp32bf16_tn_32x64_bshuffle_splitkE,0.0,86.89,915.05
256,128,4096,512,False,torch.bfloat16,torch.bfloat16,False,True,asm,1,1,6.3711,_ZN5aiter42bf16gemm_fp32bf16_tn_32x64_bshuffle_splitkE,0.0,84.27,843.49
256,136,4096,512,False,torch.bfloat16,torch.bfloat16,False,True,asm,3,1,5.9805,_ZN5aiter42bf16gemm_fp32bf16_tn_48x64_bshuffle_splitkE,0.0,95.38,910.91
256,144,4096,512,False,torch.bfloat16,torch.bfloat16,False,True,asm,3,1,5.9889,_ZN5aiter42bf16gemm_fp32bf16_tn_48x64_bshuffle_splitkE,0.0,100.85,921.94
256,152,4096,512,False,torch.bfloat16,torch.bfloat16,False,True,asm,3,1,6.0637,_ZN5aiter42bf16gemm_fp32bf16_tn_48x64_bshuffle_splitkE,0.0,105.14,922.73
256,160,4096,512,False,torch.bfloat16,torch.bfloat16,False,True,asm,3,1,5.9757,_ZN5aiter42bf16gemm_fp32bf16_tn_48x64_bshuffle_splitkE,0.0,112.3,948.65
256,168,4096,512,False,torch.bfloat16,torch.bfloat16,False,True,asm,3,1,6.5974,_ZN5aiter42bf16gemm_fp32bf16_tn_48x64_bshuffle_splitkE,0.0,106.81,870.43
256,176,4096,512,False,torch.bfloat16,torch.bfloat16,False,True,asm,3,1,6.6733,_ZN5aiter42bf16gemm_fp32bf16_tn_48x64_bshuffle_splitkE,0.0,110.62,871.58
256,184,4096,512,False,torch.bfloat16,torch.bfloat16,False,True,asm,3,1,6.0702,_ZN5aiter42bf16gemm_fp32bf16_tn_48x64_bshuffle_splitkE,0.0,127.14,970.32
256,192,4096,512,False,torch.bfloat16,torch.bfloat16,False,True,asm,3,1,6.1171,_ZN5aiter42bf16gemm_fp32bf16_tn_48x64_bshuffle_splitkE,0.0,131.65,974.94
256,200,4096,512,False,torch.bfloat16,torch.bfloat16,False,True,asm,5,1,6.3696,_ZN5aiter42bf16gemm_fp32bf16_tn_64x64_bshuffle_splitkE,0.0,131.7,947.86
256,208,4096,512,False,torch.bfloat16,torch.bfloat16,False,True,asm,5,1,6.4302,_ZN5aiter42bf16gemm_fp32bf16_tn_64x64_bshuffle_splitkE,0.0,135.67,950.4
256,216,4096,512,False,torch.bfloat16,torch.bfloat16,False,True,asm,5,1,6.4536,_ZN5aiter42bf16gemm_fp32bf16_tn_64x64_bshuffle_splitkE,0.0,140.38,958.37
256,224,4096,512,False,torch.bfloat16,torch.bfloat16,False,True,asm,5,1,6.4416,_ZN5aiter42bf16gemm_fp32bf16_tn_64x64_bshuffle_splitkE,0.0,145.85,971.6
256,232,4096,512,False,torch.bfloat16,torch.bfloat16,False,True,asm,8,1,6.9494,_ZN5aiter42bf16gemm_fp32bf16_tn_96x64_bshuffle_splitkE,0.0,140.02,911.22
256,240,4096,512,False,torch.bfloat16,torch.bfloat16,False,True,asm,5,1,6.4693,_ZN5aiter42bf16gemm_fp32bf16_tn_64x64_bshuffle_splitkE,0.0,155.6,990.24
256,248,4096,512,False,torch.bfloat16,torch.bfloat16,False,True,asm,5,1,6.4771,_ZN5aiter42bf16gemm_fp32bf16_tn_64x64_bshuffle_splitkE,0.0,160.59,1000.43
256,256,4096,512,False,torch.bfloat16,torch.bfloat16,False,True,asm,5,1,6.4509,_ZN5aiter42bf16gemm_fp32bf16_tn_64x64_bshuffle_splitkE,0.0,166.45,1015.92
256,264,4096,512,False,torch.bfloat16,torch.bfloat16,False,True,asm,8,1,7.0128,_ZN5aiter42bf16gemm_fp32bf16_tn_96x64_bshuffle_splitkE,0.0,157.9,945.03
256,272,4096,512,False,torch.bfloat16,torch.bfloat16,False,True,asm,8,1,7.5562,_ZN5aiter42bf16gemm_fp32bf16_tn_96x64_bshuffle_splitkE,0.0,150.98,886.83
256,280,4096,512,False,torch.bfloat16,torch.bfloat16,False,True,asm,8,1,7.117,_ZN5aiter42bf16gemm_fp32bf16_tn_96x64_bshuffle_splitkE,0.0,165.01,951.92
256,288,4096,512,False,torch.bfloat16,torch.bfloat16,False,True,asm,8,1,7.1353,_ZN5aiter42bf16gemm_fp32bf16_tn_96x64_bshuffle_splitkE,0.0,169.29,959.81
256,296,4096,512,False,torch.bfloat16,torch.bfloat16,False,True,asm,8,1,7.1391,_ZN5aiter42bf16gemm_fp32bf16_tn_96x64_bshuffle_splitkE,0.0,173.9,969.62
256,304,4096,512,False,torch.bfloat16,torch.bfloat16,False,True,asm,8,1,7.5891,_ZN5aiter42bf16gemm_fp32bf16_tn_96x64_bshuffle_splitkE,0.0,168.01,921.84
256,312,4096,512,False,torch.bfloat16,torch.bfloat16,False,True,asm,8,1,7.1684,_ZN5aiter42bf16gemm_fp32bf16_tn_96x64_bshuffle_splitkE,0.0,182.55,986.23
256,320,4096,512,False,torch.bfloat16,torch.bfloat16,False,True,asm,8,1,7.6513,_ZN5aiter42bf16gemm_fp32bf16_tn_96x64_bshuffle_splitkE,0.0,175.42,933.62
256,328,4096,512,False,torch.bfloat16,torch.bfloat16,False,True,asm,8,1,7.6031,_ZN5aiter42bf16gemm_fp32bf16_tn_96x64_bshuffle_splitkE,0.0,180.94,949.24
256,336,4096,512,False,torch.bfloat16,torch.bfloat16,False,True,asm,8,1,7.2027,_ZN5aiter42bf16gemm_fp32bf16_tn_96x64_bshuffle_splitkE,0.0,195.66,1012.24
256,344,4096,512,False,torch.bfloat16,torch.bfloat16,False,True,asm,8,1,7.6455,_ZN5aiter42bf16gemm_fp32bf16_tn_96x64_bshuffle_splitkE,0.0,188.72,963.26
256,352,4096,512,False,torch.bfloat16,torch.bfloat16,False,True,asm,8,1,7.7445,_ZN5aiter42bf16gemm_fp32bf16_tn_96x64_bshuffle_splitkE,0.0,190.64,960.47
256,360,4096,512,False,torch.bfloat16,torch.bfloat16,False,True,asm,8,1,7.7391,_ZN5aiter42bf16gemm_fp32bf16_tn_96x64_bshuffle_splitkE,0.0,195.11,970.66
256,368,4096,512,False,torch.bfloat16,torch.bfloat16,False,True,asm,8,1,7.6803,_ZN5aiter42bf16gemm_fp32bf16_tn_96x64_bshuffle_splitkE,0.0,200.97,987.69
256,376,4096,512,False,torch.bfloat16,torch.bfloat16,False,True,asm,8,1,7.7675,_ZN5aiter42bf16gemm_fp32bf16_tn_96x64_bshuffle_splitkE,0.0,203.03,986.1
256,384,4096,512,False,torch.bfloat16,torch.bfloat16,False,True,asm,8,1,7.7171,_ZN5aiter42bf16gemm_fp32bf16_tn_96x64_bshuffle_splitkE,0.0,208.71,1002.09
256,392,4096,512,False,torch.bfloat16,torch.bfloat16,False,True,asm,10,1,8.3287,_ZN5aiter43bf16gemm_fp32bf16_tn_128x64_bshuffle_splitkE,0.0,197.41,937.36
256,400,4096,512,False,torch.bfloat16,torch.bfloat16,False,True,asm,10,1,8.3722,_ZN5aiter43bf16gemm_fp32bf16_tn_128x64_bshuffle_splitkE,0.0,200.39,941.29
256,408,4096,512,False,torch.bfloat16,torch.bfloat16,False,True,asm,10,1,8.3979,_ZN5aiter43bf16gemm_fp32bf16_tn_128x64_bshuffle_splitkE,0.0,203.77,947.19
256,416,4096,512,False,torch.bfloat16,torch.bfloat16,False,True,asm,10,1,8.3698,_ZN5aiter43bf16gemm_fp32bf16_tn_128x64_bshuffle_splitkE,0.0,208.47,959.18
256,424,4096,512,False,torch.bfloat16,torch.bfloat16,False,True,asm,10,1,8.1082,_ZN5aiter43bf16gemm_fp32bf16_tn_128x64_bshuffle_splitkE,0.0,219.33,999.22
256,432,4096,512,False,torch.bfloat16,torch.bfloat16,False,True,asm,10,1,8.0939,_ZN5aiter43bf16gemm_fp32bf16_tn_128x64_bshuffle_splitkE,0.0,223.86,1010.1
256,440,4096,512,False,torch.bfloat16,torch.bfloat16,False,True,asm,10,1,8.0927,_ZN5aiter43bf16gemm_fp32bf16_tn_128x64_bshuffle_splitkE,0.0,228.04,1019.36
256,448,4096,512,False,torch.bfloat16,torch.bfloat16,False,True,asm,10,1,8.1078,_ZN5aiter43bf16gemm_fp32bf16_tn_128x64_bshuffle_splitkE,0.0,231.76,1026.55
256,456,4096,512,False,torch.bfloat16,torch.bfloat16,False,True,asm,10,1,8.4605,_ZN5aiter43bf16gemm_fp32bf16_tn_128x64_bshuffle_splitkE,0.0,226.06,992.47
256,464,4096,512,False,torch.bfloat16,torch.bfloat16,False,True,asm,10,1,8.2016,_ZN5aiter43bf16gemm_fp32bf16_tn_128x64_bshuffle_splitkE,0.0,237.29,1032.79
256,472,4096,512,False,torch.bfloat16,torch.bfloat16,False,True,asm,10,1,8.456,_ZN5aiter43bf16gemm_fp32bf16_tn_128x64_bshuffle_splitkE,0.0,234.12,1010.44
256,480,4096,512,False,torch.bfloat16,torch.bfloat16,False,True,asm,10,1,8.5607,_ZN5aiter43bf16gemm_fp32bf16_tn_128x64_bshuffle_splitkE,0.0,235.18,1006.69
256,488,4096,512,False,torch.bfloat16,torch.bfloat16,False,True,asm,10,1,8.5709,_ZN5aiter43bf16gemm_fp32bf16_tn_128x64_bshuffle_splitkE,0.0,238.81,1014.1
256,496,4096,512,False,torch.bfloat16,torch.bfloat16,False,True,asm,10,1,8.2259,_ZN5aiter43bf16gemm_fp32bf16_tn_128x64_bshuffle_splitkE,0.0,252.91,1065.59
256,504,4096,512,False,torch.bfloat16,torch.bfloat16,False,True,asm,10,1,8.566,_ZN5aiter43bf16gemm_fp32bf16_tn_128x64_bshuffle_splitkE,0.0,246.78,1031.89
256,512,4096,512,False,torch.bfloat16,torch.bfloat16,False,True,asm,10,1,8.2465,_ZN5aiter43bf16gemm_fp32bf16_tn_128x64_bshuffle_splitkE,0.0,260.41,1080.81
256,1,7168,512,False,torch.bfloat16,torch.bfloat16,False,True,asm,1,1,6.2231,_ZN5aiter42bf16gemm_fp32bf16_tn_32x64_bshuffle_splitkE,0.0,1.18,1181.95
256,1,7168,2048,False,torch.bfloat16,torch.bfloat16,False,True,asm,4,2,10.6056,_ZN5aiter48bf16gemm_fp32bf16_tn_48x64_bshuffle_splitk_cleanE,0.0025,2.77,2770.1
256,2,7168,512,False,torch.bfloat16,torch.bfloat16,False,True,asm,1,1,5.7518,_ZN5aiter42bf16gemm_fp32bf16_tn_32x64_bshuffle_splitkE,0.0,2.55,1281.47
256,2,7168,2048,False,torch.bfloat16,torch.bfloat16,False,True,asm,2,2,10.5025,_ZN5aiter48bf16gemm_fp32bf16_tn_32x64_bshuffle_splitk_cleanE,0.0026,5.59,2799.05
256,4,7168,512,False,torch.bfloat16,torch.bfloat16,False,True,asm,1,1,6.2682,_ZN5aiter42bf16gemm_fp32bf16_tn_32x64_bshuffle_splitkE,0.0,4.68,1180.8
256,4,7168,2048,False,torch.bfloat16,torch.bfloat16,False,True,asm,2,2,10.6267,_ZN5aiter48bf16gemm_fp32bf16_tn_32x64_bshuffle_splitk_cleanE,0.0028,11.05,2769.8
256,8,7168,512,False,torch.bfloat16,torch.bfloat16,False,True,asm,1,1,6.2795,_ZN5aiter42bf16gemm_fp32bf16_tn_32x64_bshuffle_splitkE,0.0,9.35,1188.46
256,8,7168,2048,False,torch.bfloat16,torch.bfloat16,False,True,asm,2,2,10.926,_ZN5aiter48bf16gemm_fp32bf16_tn_32x64_bshuffle_splitk_cleanE,0.0035,21.5,2700.68
256,16,7168,512,False,torch.bfloat16,torch.bfloat16,False,True,asm,1,1,5.8363,_ZN5aiter42bf16gemm_fp32bf16_tn_32x64_bshuffle_splitkE,0.0,20.12,1299.76
256,16,7168,2048,False,torch.bfloat16,torch.bfloat16,False,True,asm,4,2,11.1248,_ZN5aiter48bf16gemm_fp32bf16_tn_48x64_bshuffle_splitk_cleanE,0.0034,42.23,2665.67
256,24,7168,512,False,torch.bfloat16,torch.bfloat16,False,True,asm,3,1,6.0343,_ZN5aiter42bf16gemm_fp32bf16_tn_48x64_bshuffle_splitkE,0.0,29.19,1277.48
256,24,7168,2048,False,torch.bfloat16,torch.bfloat16,False,True,asm,2,2,11.3222,_ZN5aiter48bf16gemm_fp32bf16_tn_32x64_bshuffle_splitk_cleanE,0.0034,62.24,2632.22
256,32,7168,512,False,torch.bfloat16,torch.bfloat16,False,True,asm,3,1,6.1159,_ZN5aiter42bf16gemm_fp32bf16_tn_48x64_bshuffle_splitkE,0.0,38.4,1280.52
256,32,7168,2048,False,torch.bfloat16,torch.bfloat16,False,True,asm,2,2,11.2374,_ZN5aiter48bf16gemm_fp32bf16_tn_32x64_bshuffle_splitk_cleanE,0.0034,83.61,2665.2
256,40,7168,512,False,torch.bfloat16,torch.bfloat16,False,True,asm,3,1,6.2199,_ZN5aiter42bf16gemm_fp32bf16_tn_48x64_bshuffle_splitkE,0.0,47.2,1278.87
256,40,7168,2048,False,torch.bfloat16,torch.bfloat16,False,True,asm,6,2,11.8732,_ZN5aiter48bf16gemm_fp32bf16_tn_64x64_bshuffle_splitk_cleanE,0.0034,98.91,2534.9
256,48,7168,512,False,torch.bfloat16,torch.bfloat16,False,True,asm,1,1,6.5563,_ZN5aiter42bf16gemm_fp32bf16_tn_32x64_bshuffle_splitkE,0.0,53.74,1231.99
256,48,7168,2048,False,torch.bfloat16,torch.bfloat16,False,True,asm,4,2,11.6888,_ZN5aiter48bf16gemm_fp32bf16_tn_48x64_bshuffle_splitk_cleanE,0.0034,120.57,2587.51
256,56,7168,512,False,torch.bfloat16,torch.bfloat16,False,True,asm,1,1,6.0076,_ZN5aiter42bf16gemm_fp32bf16_tn_32x64_bshuffle_splitkE,0.0,68.42,1364.97
256,56,7168,2048,False,torch.bfloat16,torch.bfloat16,False,True,asm,6,2,12.2283,_ZN5aiter48bf16gemm_fp32bf16_tn_64x64_bshuffle_splitk_cleanE,0.0034,134.46,2485.41
256,64,7168,512,False,torch.bfloat16,torch.bfloat16,False,True,asm,1,1,6.5639,_ZN5aiter42bf16gemm_fp32bf16_tn_32x64_bshuffle_splitkE,0.0,71.57,1268.01
256,64,7168,2048,False,torch.bfloat16,torch.bfloat16,False,True,asm,6,2,12.4144,_ZN5aiter48bf16gemm_fp32bf16_tn_64x64_bshuffle_splitk_cleanE,0.0034,151.36,2460.03
256,72,7168,512,False,torch.bfloat16,torch.bfloat16,False,True,asm,3,1,6.8787,_ZN5aiter42bf16gemm_fp32bf16_tn_48x64_bshuffle_splitkE,0.0,76.83,1227.84
256,72,7168,2048,False,torch.bfloat16,torch.bfloat16,False,True,asm,7,2,12.6036,_ZN5aiter48bf16gemm_fp32bf16_tn_80x64_bshuffle_splitk_cleanE,0.0034,167.72,2434.8
256,80,7168,512,False,torch.bfloat16,torch.bfloat16,False,True,asm,5,1,6.6272,_ZN5aiter42bf16gemm_fp32bf16_tn_64x64_bshuffle_splitkE,0.0,88.6,1292.98
256,80,7168,2048,False,torch.bfloat16,torch.bfloat16,False,True,asm,7,2,12.7991,_ZN5aiter48bf16gemm_fp32bf16_tn_80x64_bshuffle_splitk_cleanE,0.0034,183.51,2409.13
256,88,7168,512,False,torch.bfloat16,torch.bfloat16,False,True,asm,5,1,6.6601,_ZN5aiter42bf16gemm_fp32bf16_tn_64x64_bshuffle_splitkE,0.0,96.98,1305.04
256,88,7168,2048,False,torch.bfloat16,torch.bfloat16,False,True,asm,9,2,13.49,_ZN5aiter48bf16gemm_fp32bf16_tn_96x64_bshuffle_splitk_cleanE,0.0034,191.53,2296.67
256,96,7168,512,False,torch.bfloat16,torch.bfloat16,False,True,asm,3,1,6.8678,_ZN5aiter42bf16gemm_fp32bf16_tn_48x64_bshuffle_splitkE,0.0,102.6,1283.47
256,96,7168,2048,False,torch.bfloat16,torch.bfloat16,False,True,asm,9,2,13.313,_ZN5aiter48bf16gemm_fp32bf16_tn_96x64_bshuffle_splitk_cleanE,0.0034,211.72,2338.29
256,104,7168,512,False,torch.bfloat16,torch.bfloat16,False,True,asm,5,1,6.7167,_ZN5aiter42bf16gemm_fp32bf16_tn_64x64_bshuffle_splitkE,0.0,113.65,1330.63
256,104,7168,2048,False,torch.bfloat16,torch.bfloat16,False,True,asm,11,2,14.3805,_ZN5aiter49bf16gemm_fp32bf16_tn_128x64_bshuffle_splitk_cleanE,0.0034,212.33,2174.96
256,112,7168,512,False,torch.bfloat16,torch.bfloat16,False,True,asm,5,1,7.1762,_ZN5aiter42bf16gemm_fp32bf16_tn_64x64_bshuffle_splitkE,0.0,114.56,1262.56
256,112,7168,2048,False,torch.bfloat16,torch.bfloat16,False,True,asm,5,1,14.4974,_ZN5aiter42bf16gemm_fp32bf16_tn_64x64_bshuffle_splitkE,0.0,226.82,2167.6
256,120,7168,512,False,torch.bfloat16,torch.bfloat16,False,True,asm,5,1,7.2438,_ZN5aiter42bf16gemm_fp32bf16_tn_64x64_bshuffle_splitkE,0.0,121.59,1267.74
256,120,7168,2048,False,torch.bfloat16,torch.bfloat16,False,True,asm,5,1,14.8537,_ZN5aiter42bf16gemm_fp32bf16_tn_64x64_bshuffle_splitkE,0.0,237.19,2125.53
256,128,7168,512,False,torch.bfloat16,torch.bfloat16,False,True,asm,5,1,6.7853,_ZN5aiter42bf16gemm_fp32bf16_tn_64x64_bshuffle_splitkE,0.0,138.46,1371.51
256,128,7168,2048,False,torch.bfloat16,torch.bfloat16,False,True,asm,5,1,14.9015,_ZN5aiter42bf16gemm_fp32bf16_tn_64x64_bshuffle_splitkE,0.0,252.2,2128.61
256,136,7168,512,False,torch.bfloat16,torch.bfloat16,False,True,asm,8,1,7.7966,_ZN5aiter42bf16gemm_fp32bf16_tn_96x64_bshuffle_splitkE,0.0,128.04,1209.37
256,136,7168,2048,False,torch.bfloat16,torch.bfloat16,False,True,asm,13,2,16.0474,_ZN5aiter49bf16gemm_fp32bf16_tn_160x64_bshuffle_splitk_cleanE,0.0034,248.82,1985.8
256,144,7168,512,False,torch.bfloat16,torch.bfloat16,False,True,asm,8,1,7.8291,_ZN5aiter42bf16gemm_fp32bf16_tn_96x64_bshuffle_splitkE,0.0,135.0,1220.05
256,144,7168,2048,False,torch.bfloat16,torch.bfloat16,False,True,asm,8,1,16.0299,_ZN5aiter42bf16gemm_fp32bf16_tn_96x64_bshuffle_splitkE,0.0,263.75,1997.16
256,152,7168,512,False,torch.bfloat16,torch.bfloat16,False,True,asm,8,1,7.8361,_ZN5aiter42bf16gemm_fp32bf16_tn_96x64_bshuffle_splitkE,0.0,142.38,1234.64
256,152,7168,2048,False,torch.bfloat16,torch.bfloat16,False,True,asm,8,1,16.2071,_ZN5aiter42bf16gemm_fp32bf16_tn_96x64_bshuffle_splitkE,0.0,275.36,1984.43
256,160,7168,512,False,torch.bfloat16,torch.bfloat16,False,True,asm,8,1,7.4726,_ZN5aiter42bf16gemm_fp32bf16_tn_96x64_bshuffle_splitkE,0.0,157.16,1311.14
256,160,7168,2048,False,torch.bfloat16,torch.bfloat16,False,True,asm,8,1,16.3113,_ZN5aiter42bf16gemm_fp32bf16_tn_96x64_bshuffle_splitkE,0.0,288.0,1980.79
256,168,7168,512,False,torch.bfloat16,torch.bfloat16,False,True,asm,8,1,7.5102,_ZN5aiter42bf16gemm_fp32bf16_tn_96x64_bshuffle_splitkE,0.0,164.19,1320.94
256,168,7168,2048,False,torch.bfloat16,torch.bfloat16,False,True,asm,8,1,16.2983,_ZN5aiter42bf16gemm_fp32bf16_tn_96x64_bshuffle_splitkE,0.0,302.64,1991.42
256,176,7168,512,False,torch.bfloat16,torch.bfloat16,False,True,asm,8,1,7.5676,_ZN5aiter42bf16gemm_fp32bf16_tn_96x64_bshuffle_splitkE,0.0,170.71,1327.16
256,176,7168,2048,False,torch.bfloat16,torch.bfloat16,False,True,asm,8,1,16.324,_ZN5aiter42bf16gemm_fp32bf16_tn_96x64_bshuffle_splitkE,0.0,316.55,1997.31
256,184,7168,512,False,torch.bfloat16,torch.bfloat16,False,True,asm,8,1,7.9546,_ZN5aiter42bf16gemm_fp32bf16_tn_96x64_bshuffle_splitkE,0.0,169.78,1278.04
256,184,7168,2048,False,torch.bfloat16,torch.bfloat16,False,True,asm,8,1,16.3828,_ZN5aiter42bf16gemm_fp32bf16_tn_96x64_bshuffle_splitkE,0.0,329.75,1999.15
256,192,7168,512,False,torch.bfloat16,torch.bfloat16,False,True,asm,8,1,8.028,_ZN5aiter42bf16gemm_fp32bf16_tn_96x64_bshuffle_splitkE,0.0,175.55,1281.66
256,192,7168,2048,False,torch.bfloat16,torch.bfloat16,False,True,asm,8,1,16.5566,_ZN5aiter42bf16gemm_fp32bf16_tn_96x64_bshuffle_splitkE,0.0,340.48,1987.07
256,200,7168,512,False,torch.bfloat16,torch.bfloat16,False,True,asm,10,1,8.2739,_ZN5aiter43bf16gemm_fp32bf16_tn_128x64_bshuffle_splitkE,0.0,177.43,1258.42
256,200,7168,2048,False,torch.bfloat16,torch.bfloat16,False,True,asm,10,1,18.1359,_ZN5aiter43bf16gemm_fp32bf16_tn_128x64_bshuffle_splitkE,0.0,323.78,1822.16
256,208,7168,512,False,torch.bfloat16,torch.bfloat16,False,True,asm,10,1,8.6444,_ZN5aiter43bf16gemm_fp32bf16_tn_128x64_bshuffle_splitkE,0.0,176.61,1218.7
256,208,7168,2048,False,torch.bfloat16,torch.bfloat16,False,True,asm,10,1,18.2512,_ZN5aiter43bf16gemm_fp32bf16_tn_128x64_bshuffle_splitkE,0.0,334.6,1818.73
256,216,7168,512,False,torch.bfloat16,torch.bfloat16,False,True,asm,10,1,8.6174,_ZN5aiter43bf16gemm_fp32bf16_tn_128x64_bshuffle_splitkE,0.0,183.98,1236.78
256,216,7168,2048,False,torch.bfloat16,torch.bfloat16,False,True,asm,10,1,18.253,_ZN5aiter43bf16gemm_fp32bf16_tn_128x64_bshuffle_splitkE,0.0,347.44,1826.63
256,224,7168,512,False,torch.bfloat16,torch.bfloat16,False,True,asm,10,1,8.6492,_ZN5aiter43bf16gemm_fp32bf16_tn_128x64_bshuffle_splitkE,0.0,190.09,1246.44
256,224,7168,2048,False,torch.bfloat16,torch.bfloat16,False,True,asm,10,1,18.2958,_ZN5aiter43bf16gemm_fp32bf16_tn_128x64_bshuffle_splitkE,0.0,359.46,1830.41
256,232,7168,512,False,torch.bfloat16,torch.bfloat16,False,True,asm,10,1,8.6578,_ZN5aiter43bf16gemm_fp32bf16_tn_128x64_bshuffle_splitkE,0.0,196.69,1259.39
256,232,7168,2048,False,torch.bfloat16,torch.bfloat16,False,True,asm,10,1,18.3247,_ZN5aiter43bf16gemm_fp32bf16_tn_128x64_bshuffle_splitkE,0.0,371.71,1835.57
256,240,7168,512,False,torch.bfloat16,torch.bfloat16,False,True,asm,10,1,8.7573,_ZN5aiter43bf16gemm_fp32bf16_tn_128x64_bshuffle_splitkE,0.0,201.16,1259.11
256,240,7168,2048,False,torch.bfloat16,torch.bfloat16,False,True,asm,10,1,18.4001,_ZN5aiter43bf16gemm_fp32bf16_tn_128x64_bshuffle_splitkE,0.0,382.96,1836.07
256,248,7168,512,False,torch.bfloat16,torch.bfloat16,False,True,asm,10,1,8.4725,_ZN5aiter43bf16gemm_fp32bf16_tn_128x64_bshuffle_splitkE,0.0,214.85,1315.94
256,248,7168,2048,False,torch.bfloat16,torch.bfloat16,False,True,asm,10,1,18.5453,_ZN5aiter43bf16gemm_fp32bf16_tn_128x64_bshuffle_splitkE,0.0,392.62,1829.64
256,256,7168,512,False,torch.bfloat16,torch.bfloat16,False,True,asm,10,1,8.8649,_ZN5aiter43bf16gemm_fp32bf16_tn_128x64_bshuffle_splitkE,0.0,211.96,1271.55
256,256,7168,2048,False,torch.bfloat16,torch.bfloat16,False,True,asm,10,1,18.7156,_ZN5aiter43bf16gemm_fp32bf16_tn_128x64_bshuffle_splitkE,0.0,401.6,1820.87
256,264,7168,512,False,torch.bfloat16,torch.bfloat16,False,True,asm,12,1,9.2099,_ZN5aiter43bf16gemm_fp32bf16_tn_160x64_bshuffle_splitkE,0.0,210.4,1237.26
256,264,7168,2048,False,torch.bfloat16,torch.bfloat16,False,True,asm,12,1,20.5145,_ZN5aiter43bf16gemm_fp32bf16_tn_160x64_bshuffle_splitkE,0.0,377.83,1668.39
256,272,7168,512,False,torch.bfloat16,torch.bfloat16,False,True,asm,12,1,9.2036,_ZN5aiter43bf16gemm_fp32bf16_tn_160x64_bshuffle_splitkE,0.0,216.92,1251.46
256,272,7168,2048,False,torch.bfloat16,torch.bfloat16,False,True,asm,12,1,20.6311,_ZN5aiter43bf16gemm_fp32bf16_tn_160x64_bshuffle_splitkE,0.0,387.08,1666.11
256,280,7168,512,False,torch.bfloat16,torch.bfloat16,False,True,asm,12,1,9.4881,_ZN5aiter43bf16gemm_fp32bf16_tn_160x64_bshuffle_splitkE,0.0,216.61,1226.89
256,280,7168,2048,False,torch.bfloat16,torch.bfloat16,False,True,asm,12,1,20.6518,_ZN5aiter43bf16gemm_fp32bf16_tn_160x64_bshuffle_splitkE,0.0,398.07,1671.58
256,288,7168,512,False,torch.bfloat16,torch.bfloat16,False,True,asm,12,1,9.5945,_ZN5aiter43bf16gemm_fp32bf16_tn_160x64_bshuffle_splitkE,0.0,220.33,1226.09
256,288,7168,2048,False,torch.bfloat16,torch.bfloat16,False,True,asm,12,1,20.6748,_ZN5aiter43bf16gemm_fp32bf16_tn_160x64_bshuffle_splitkE,0.0,408.99,1676.85
256,296,7168,512,False,torch.bfloat16,torch.bfloat16,False,True,asm,12,1,9.6841,_ZN5aiter43bf16gemm_fp32bf16_tn_160x64_bshuffle_splitkE,0.0,224.35,1227.43
256,296,7168,2048,False,torch.bfloat16,torch.bfloat16,False,True,asm,12,1,20.7343,_ZN5aiter43bf16gemm_fp32bf16_tn_160x64_bshuffle_splitkE,0.0,419.14,1679.15
256,304,7168,512,False,torch.bfloat16,torch.bfloat16,False,True,asm,12,1,9.3844,_ZN5aiter43bf16gemm_fp32bf16_tn_160x64_bshuffle_splitkE,0.0,237.77,1279.73
256,304,7168,2048,False,torch.bfloat16,torch.bfloat16,False,True,asm,12,1,20.7873,_ZN5aiter43bf16gemm_fp32bf16_tn_160x64_bshuffle_splitkE,0.0,429.37,1681.96
256,312,7168,512,False,torch.bfloat16,torch.bfloat16,False,True,asm,12,1,9.8408,_ZN5aiter43bf16gemm_fp32bf16_tn_160x64_bshuffle_splitkE,0.0,232.71,1232.86
256,312,7168,2048,False,torch.bfloat16,torch.bfloat16,False,True,asm,12,1,20.9532,_ZN5aiter43bf16gemm_fp32bf16_tn_160x64_bshuffle_splitkE,0.0,437.18,1675.68
256,320,7168,512,False,torch.bfloat16,torch.bfloat16,False,True,asm,12,1,9.7995,_ZN5aiter43bf16gemm_fp32bf16_tn_160x64_bshuffle_splitkE,0.0,239.69,1250.6
256,320,7168,2048,False,torch.bfloat16,torch.bfloat16,False,True,asm,12,1,21.2783,_ZN5aiter43bf16gemm_fp32bf16_tn_160x64_bshuffle_splitkE,0.0,441.54,1657.01
256,328,7168,512,False,torch.bfloat16,torch.bfloat16,False,True,asm,8,1,11.4908,_ZN5aiter42bf16gemm_fp32bf16_tn_96x64_bshuffle_splitkE,0.0,209.52,1077.22
256,328,7168,2048,False,torch.bfloat16,torch.bfloat16,False,True,asm,8,1,28.2689,_ZN5aiter42bf16gemm_fp32bf16_tn_96x64_bshuffle_splitkE,0.0,340.66,1252.47
256,336,7168,512,False,torch.bfloat16,torch.bfloat16,False,True,asm,8,1,11.6795,_ZN5aiter42bf16gemm_fp32bf16_tn_96x64_bshuffle_splitkE,0.0,211.16,1070.34
256,336,7168,2048,False,torch.bfloat16,torch.bfloat16,False,True,asm,10,1,28.4621,_ZN5aiter43bf16gemm_fp32bf16_tn_128x64_bshuffle_splitkE,0.0,346.6,1249.14
256,344,7168,512,False,torch.bfloat16,torch.bfloat16,False,True,asm,8,1,11.7051,_ZN5aiter42bf16gemm_fp32bf16_tn_96x64_bshuffle_splitkE,0.0,215.72,1078.49
256,344,7168,2048,False,torch.bfloat16,torch.bfloat16,False,True,asm,10,1,28.6384,_ZN5aiter43bf16gemm_fp32bf16_tn_128x64_bshuffle_splitkE,0.0,352.67,1246.6
256,352,7168,512,False,torch.bfloat16,torch.bfloat16,False,True,asm,8,1,11.7464,_ZN5aiter42bf16gemm_fp32bf16_tn_96x64_bshuffle_splitkE,0.0,219.96,1085.16
256,352,7168,2048,False,torch.bfloat16,torch.bfloat16,False,True,asm,10,1,28.8068,_ZN5aiter43bf16gemm_fp32bf16_tn_128x64_bshuffle_splitkE,0.0,358.76,1244.44
256,360,7168,512,False,torch.bfloat16,torch.bfloat16,False,True,asm,8,1,11.96,_ZN5aiter42bf16gemm_fp32bf16_tn_96x64_bshuffle_splitkE,0.0,220.94,1076.06
256,360,7168,2048,False,torch.bfloat16,torch.bfloat16,False,True,asm,10,1,28.7976,_ZN5aiter43bf16gemm_fp32bf16_tn_128x64_bshuffle_splitkE,0.0,367.03,1249.95
256,368,7168,512,False,torch.bfloat16,torch.bfloat16,False,True,asm,8,1,12.1306,_ZN5aiter42bf16gemm_fp32bf16_tn_96x64_bshuffle_splitkE,0.0,222.67,1071.05
256,368,7168,2048,False,torch.bfloat16,torch.bfloat16,False,True,asm,10,1,29.0956,_ZN5aiter43bf16gemm_fp32bf16_tn_128x64_bshuffle_splitkE,0.0,371.35,1242.22
256,376,7168,512,False,torch.bfloat16,torch.bfloat16,False,True,asm,8,1,12.1439,_ZN5aiter42bf16gemm_fp32bf16_tn_96x64_bshuffle_splitkE,0.0,227.26,1080.0
256,376,7168,2048,False,torch.bfloat16,torch.bfloat16,False,True,asm,10,1,29.1945,_ZN5aiter43bf16gemm_fp32bf16_tn_128x64_bshuffle_splitkE,0.0,378.13,1243.06
256,384,7168,512,False,torch.bfloat16,torch.bfloat16,False,True,asm,8,1,12.3118,_ZN5aiter42bf16gemm_fp32bf16_tn_96x64_bshuffle_splitkE,0.0,228.93,1075.25
256,384,7168,2048,False,torch.bfloat16,torch.bfloat16,False,True,asm,10,1,29.627,_ZN5aiter43bf16gemm_fp32bf16_tn_128x64_bshuffle_splitkE,0.0,380.54,1229.89
256,392,7168,512,False,torch.bfloat16,torch.bfloat16,False,True,asm,10,1,13.2252,_ZN5aiter43bf16gemm_fp32bf16_tn_128x64_bshuffle_splitkE,0.0,217.56,1010.28
256,392,7168,2048,False,torch.bfloat16,torch.bfloat16,False,True,asm,10,1,30.4992,_ZN5aiter43bf16gemm_fp32bf16_tn_128x64_bshuffle_splitkE,0.0,377.36,1199.56
256,400,7168,512,False,torch.bfloat16,torch.bfloat16,False,True,asm,10,1,13.3657,_ZN5aiter43bf16gemm_fp32bf16_tn_128x64_bshuffle_splitkE,0.0,219.67,1008.85
256,400,7168,2048,False,torch.bfloat16,torch.bfloat16,False,True,asm,10,1,30.9867,_ZN5aiter43bf16gemm_fp32bf16_tn_128x64_bshuffle_splitkE,0.0,379.0,1185.44
256,408,7168,512,False,torch.bfloat16,torch.bfloat16,False,True,asm,10,1,13.0783,_ZN5aiter43bf16gemm_fp32bf16_tn_128x64_bshuffle_splitkE,0.0,228.98,1040.42
256,408,7168,2048,False,torch.bfloat16,torch.bfloat16,False,True,asm,10,1,31.0508,_ZN5aiter43bf16gemm_fp32bf16_tn_128x64_bshuffle_splitkE,0.0,385.78,1187.74
256,416,7168,512,False,torch.bfloat16,torch.bfloat16,False,True,asm,10,1,13.3217,_ZN5aiter43bf16gemm_fp32bf16_tn_128x64_bshuffle_splitkE,0.0,229.21,1030.63
256,416,7168,2048,False,torch.bfloat16,torch.bfloat16,False,True,asm,10,1,31.432,_ZN5aiter43bf16gemm_fp32bf16_tn_128x64_bshuffle_splitkE,0.0,388.58,1178.03
256,424,7168,512,False,torch.bfloat16,torch.bfloat16,False,True,asm,10,1,13.1992,_ZN5aiter43bf16gemm_fp32bf16_tn_128x64_bshuffle_splitkE,0.0,235.79,1049.51
256,424,7168,2048,False,torch.bfloat16,torch.bfloat16,False,True,asm,10,1,31.58,_ZN5aiter43bf16gemm_fp32bf16_tn_128x64_bshuffle_splitkE,0.0,394.2,1177.18
256,432,7168,512,False,torch.bfloat16,torch.bfloat16,False,True,asm,10,1,13.1855,_ZN5aiter43bf16gemm_fp32bf16_tn_128x64_bshuffle_splitkE,0.0,240.48,1059.92
256,432,7168,2048,False,torch.bfloat16,torch.bfloat16,False,True,asm,10,1,31.8816,_ZN5aiter43bf16gemm_fp32bf16_tn_128x64_bshuffle_splitkE,0.0,397.83,1170.67
256,440,7168,512,False,torch.bfloat16,torch.bfloat16,False,True,asm,10,1,13.2493,_ZN5aiter43bf16gemm_fp32bf16_tn_128x64_bshuffle_splitkE,0.0,243.76,1064.09
256,440,7168,2048,False,torch.bfloat16,torch.bfloat16,False,True,asm,10,1,32.0303,_ZN5aiter43bf16gemm_fp32bf16_tn_128x64_bshuffle_splitkE,0.0,403.32,1169.84
256,448,7168,512,False,torch.bfloat16,torch.bfloat16,False,True,asm,10,1,13.3136,_ZN5aiter43bf16gemm_fp32bf16_tn_128x64_bshuffle_splitkE,0.0,246.99,1068.18
256,448,7168,2048,False,torch.bfloat16,torch.bfloat16,False,True,asm,10,1,32.5308,_ZN5aiter43bf16gemm_fp32bf16_tn_128x64_bshuffle_splitkE,0.0,404.33,1156.37
256,456,7168,512,False,torch.bfloat16,torch.bfloat16,False,True,asm,10,1,13.5693,_ZN5aiter43bf16gemm_fp32bf16_tn_128x64_bshuffle_splitkE,0.0,246.66,1057.11
256,456,7168,2048,False,torch.bfloat16,torch.bfloat16,False,True,asm,10,1,32.574,_ZN5aiter43bf16gemm_fp32bf16_tn_128x64_bshuffle_splitkE,0.0,411.01,1159.36
256,464,7168,512,False,torch.bfloat16,torch.bfloat16,False,True,asm,10,1,13.6762,_ZN5aiter43bf16gemm_fp32bf16_tn_128x64_bshuffle_splitkE,0.0,249.03,1057.83
256,464,7168,2048,False,torch.bfloat16,torch.bfloat16,False,True,asm,10,1,32.7107,_ZN5aiter43bf16gemm_fp32bf16_tn_128x64_bshuffle_splitkE,0.0,416.47,1159.03
256,472,7168,512,False,torch.bfloat16,torch.bfloat16,False,True,asm,10,1,13.6971,_ZN5aiter43bf16gemm_fp32bf16_tn_128x64_bshuffle_splitkE,0.0,252.94,1065.19
256,472,7168,2048,False,torch.bfloat16,torch.bfloat16,False,True,asm,10,1,32.8674,_ZN5aiter43bf16gemm_fp32bf16_tn_128x64_bshuffle_splitkE,0.0,421.63,1157.99
256,480,7168,512,False,torch.bfloat16,torch.bfloat16,False,True,asm,10,1,13.7138,_ZN5aiter43bf16gemm_fp32bf16_tn_128x64_bshuffle_splitkE,0.0,256.91,1072.85
256,480,7168,2048,False,torch.bfloat16,torch.bfloat16,False,True,asm,10,1,33.1785,_ZN5aiter43bf16gemm_fp32bf16_tn_128x64_bshuffle_splitkE,0.0,424.76,1151.57
256,488,7168,512,False,torch.bfloat16,torch.bfloat16,False,True,asm,10,1,13.9804,_ZN5aiter43bf16gemm_fp32bf16_tn_128x64_bshuffle_splitkE,0.0,256.21,1061.18
256,488,7168,2048,False,torch.bfloat16,torch.bfloat16,False,True,asm,10,1,33.4974,_ZN5aiter43bf16gemm_fp32bf16_tn_128x64_bshuffle_splitkE,0.0,427.73,1145.01
256,496,7168,512,False,torch.bfloat16,torch.bfloat16,False,True,asm,10,1,14.163,_ZN5aiter43bf16gemm_fp32bf16_tn_128x64_bshuffle_splitkE,0.0,257.05,1056.17
256,496,7168,2048,False,torch.bfloat16,torch.bfloat16,False,True,asm,10,1,34.036,_ZN5aiter43bf16gemm_fp32bf16_tn_128x64_bshuffle_splitkE,0.0,427.86,1131.23
256,504,7168,512,False,torch.bfloat16,torch.bfloat16,False,True,asm,10,1,14.4614,_ZN5aiter43bf16gemm_fp32bf16_tn_128x64_bshuffle_splitkE,0.0,255.81,1042.88
256,504,7168,2048,False,torch.bfloat16,torch.bfloat16,False,True,asm,10,1,34.5792,_ZN5aiter43bf16gemm_fp32bf16_tn_128x64_bshuffle_splitkE,0.0,427.93,1117.72
256,512,7168,512,False,torch.bfloat16,torch.bfloat16,False,True,asm,10,1,14.5505,_ZN5aiter43bf16gemm_fp32bf16_tn_128x64_bshuffle_splitkE,0.0,258.28,1044.94
256,512,7168,2048,False,torch.bfloat16,torch.bfloat16,False,True,asm,10,1,34.9781,_ZN5aiter43bf16gemm_fp32bf16_tn_128x64_bshuffle_splitkE,0.0,429.77,1109.19
